title,link,address,company,short_description,rich_description,salary,skils
IT - специалист,https://hh.ru/vacancy/131936448?query=it&hhtmFrom=vacancy_search_list,"Ташкент, Янгихаётский район, махаллинский сход граждан Хужа Учкун, улица Истикбол, 34",СП ООО SAMIST AUTO,Имеет опыт работы,,,
IT-рекрутер в компанию,https://hh.ru/vacancy/131053198?query=it&hhtmFrom=vacancy_search_list,Астана,ТОО Smart Commerce Kazakhstan,...если в,,"300 000 – 450 000 ₸ за месяц, до вычета налогов",
IT-рекрутер,https://hh.ru/vacancy/131806585?query=it&hhtmFrom=vacancy_search_list,"Ташкент, Чиланзарский район, проспект Бунёдкор, 40/1",ООО BITO,"Коммуникация и продажи: Умение «продать» вакансию специалисту, который не ищет работу (холодные контакты), вести переговоры, обрабатывать возражения и поддерживать дружелюбный...",,"от 3 500 000 so'm за месяц, до вычета налогов",
Директор инфлюенс направления (киберспорт),https://hh.ru/vacancy/132000002?query=it&hhtmFrom=vacancy_search_list,Москва,Winline. Маркетинг,Опыт работы в digital и на руководящей позиции от 3-х лет. Опыт управления командой (от 2-х человек).,,,
Специалист IT,https://hh.ru/vacancy/131394612?query=it&hhtmFrom=vacancy_search_list,"Троицк, Троицкий бульвар, 7",ООО Архпроект,Высшее/неоконченное высшее/среднее специальное и техническое или смежное образование. Опыт работы в,,,
Юрист (IT),https://hh.ru/vacancy/131998320?query=it&hhtmFrom=vacancy_search_list,Москва,ООО БайтЭрг,...получение квалификации,,,
IT рекрутер,https://hh.ru/vacancy/131826446?query=it&hhtmFrom=vacancy_search_list,Алматы,ТОО My Startups,...в,,,
IT Специалист,https://hh.ru/vacancy/129511099?query=it&hhtmFrom=vacancy_search_list,"Всеволожский район, промзона Уткина Заводь, 4к4",Tefal,Zabbix. VBA. MS Access. SQL. Базовые навыки написания скриптов. Английский язык базовый. Базовые навыки управления проектами. Сильные коммуникативные навыки. Ответственность.,,,
IT-рекрутер,https://hh.ru/vacancy/131258707?query=it&hhtmFrom=vacancy_search_list,"Алматы, улица Абдуллы Розыбакиева, 263",ТОО My Startups,Опыт в подборе,,,
Преподаватель IT курсов,https://hh.ru/vacancy/132003991?query=it&hhtmFrom=vacancy_search_list,"Якутск, улица Кирова, 18В",Компьютерная академия TOP (Компьютерная Академия ТОП),Adobe Photoshop и Illustrator. Знание или опыт работы как минимум в одном из указанных выше направлений компьютерных технологий.,,,
IT специалист,https://hh.ru/vacancy/131203538?query=it&hhtmFrom=vacancy_search_list,"Тула, р-н Привокзальный",ООО СтарСити,"Опыт работы в технической поддержке или на аналогичной позиции от 1 года. Знание операционных систем Windows, базовые навыки работы с...",,"от 80 000 ₽ за месяц, на руки",
Руководитель IT отдела,https://hh.ru/vacancy/131274287?query=it&hhtmFrom=vacancy_search_list,Санкт-Петербург,ООО Безопасный Город,"Знание и опыт работы с компонентами ИТ-сервисов на базе Windows, Linux. Знания серверного, телеком оборудования (линеек, вендоров, принципов работы).",,"от 170 000 ₽ за месяц, на руки",
IT Business Analyst,https://hh.ru/vacancy/131217616?query=it&hhtmFrom=vacancy_search_list,Минск,Selecty,Опыт работы,,,
IT-специалист,https://hh.ru/vacancy/131987946?query=it&hhtmFrom=vacancy_search_list,"Алматы, улица Ратушного, 74А",ТОО Аяла Плюс,Внимательность и ответственность при работе с оборудованием. Навыки поиска и устранения неисправностей «на месте». Знания подсистемы Агент-Плюс приветствуется.,,,
IT Специалист,https://hh.ru/vacancy/131986479?query=it&hhtmFrom=vacancy_search_list,"Ташкент, 1-й проезд Рохат",ООО GLOBAL TEXTILE SOLUTIONS,Опыт работы 1-3 года в,,"8 800 000 so'm за месяц, на руки",
Специалист IT,https://hh.ru/vacancy/131020871?query=it&hhtmFrom=vacancy_search_list,Санкт-Петербург,ООО ПРОТЕЙ ТЛ,"Знание принципов построения сетей передачи данных (стек TCP/IP, маршрутизация и коммутация). Опыт администрирования серверного оборудования на базе ОС Linux.",,,
Помощник IT,https://hh.ru/vacancy/131984890?query=it&hhtmFrom=vacancy_search_list,"Сергиев Посад, проспект Красной Армии, 2А",ООО Научно - Инновационный Институт Профессиональной Переподготовки и Повышения Квалификации,выстроить,,,
IT-специалист,https://hh.ru/vacancy/131812882?query=it&hhtmFrom=vacancy_search_list,Казань,ООО Ремик,"Грамотная письменная и устная речь. Ответственность, исполнительность, готовность учиться новому. Активность, целеустремленность, желание развиваться в",,"от 70 000 ₽ за месяц, на руки",
IT Project Manager,https://hh.ru/vacancy/132000350?query=it&hhtmFrom=vacancy_search_list,"село Павловская Слобода, улица Ленина, 85",ООО Мэйджор Карго Сервис,имеете опыт работы,,,
Аналитик IT,https://hh.ru/vacancy/131981579?query=it&hhtmFrom=vacancy_search_list,Москва,"Программный Продукт, ИТ-компания",Опыт написания проектной документации (ГОСТ). Опыт работы системным аналитиком в заказной разработке от 2-х лет. Опыт работы в проектах...,,,
IT-разработчик,https://hh.ru/vacancy/131981063?query=it&hhtmFrom=vacancy_search_list,Москва,ООО ИКС БИО ТЕХНОЛОДЖИ,"Речь идёт о создании гибкой и масштабируемой AI-инфраструктуры, способной усиливать ключевые бизнес-процессы и быстро адаптироваться под новые задачи.",,,
Специалист IT,https://hh.ru/vacancy/131980658?query=it&hhtmFrom=vacancy_search_list,"Ташкент, Сергелийский район",ИП OOO FoamLine Vostok,Опыт поддержки пользователей в корпоративной среде. Знание клиентской платформы Microsoft Windows (Windows 10) и принципов работы Microsoft Active Directory.,,"от 15 000 000 so'm за месяц, на руки",
Руководитель IT,https://hh.ru/vacancy/130692597?query=it&hhtmFrom=vacancy_search_list,Королёв,ООО Управляющая Нефтяная Компания,Высшее техническое образование. Опыт работы на руководящих должностях в ИТ отрасли. Глубокое понимание и опыт работы с разными информационными системами...,,,
IT Project Manager,https://hh.ru/vacancy/131998480?query=it&hhtmFrom=vacancy_search_list,Астана,ОсОО Юнифан,"Хорошее владение русским языком, знание английского будет преимуществом. Умение четко и правильно излагать свои мысли - устно и письменно.",,"500 – 1 500 $ за месяц, на руки",
IT менеджер,https://hh.ru/vacancy/131978784?query=it&hhtmFrom=vacancy_search_list,Санкт-Петербург,Aston,"ИТ менеджер (Лидерская программа). Формула успеха: Прокачку всех ключевых навыков — от технических (SQL, аналитика) до управленческих. Наши требования к кандидату...",,,
IT инженер,https://hh.ru/vacancy/131977133?query=it&hhtmFrom=vacancy_search_list,Ханты-Мансийский автономный округ — Югра,ЭйчарОсы,Среднее или высшее техническое образование. Знание Linux или желание переобучиться с Windows на Linux. Опыт в аналогичной сфере не менее...,,,
IT инженер,https://hh.ru/vacancy/131977134?query=it&hhtmFrom=vacancy_search_list,Ханты-Мансийский автономный округ — Югра,ЭйчарОсы,Среднее или высшее техническое образование. Знание Linux или желание переобучиться с Windows на Linux. Опыт в аналогичной сфере не менее...,,,
IT инженер,https://hh.ru/vacancy/131977135?query=it&hhtmFrom=vacancy_search_list,Ханты-Мансийский автономный округ — Югра,ЭйчарОсы,Среднее или высшее техническое образование. Знание Linux или желание переобучиться с Windows на Linux. Опыт в аналогичной сфере не менее...,,,
Product Marketing Manager (IT),https://hh.ru/vacancy/131554152?query=it&hhtmFrom=vacancy_search_list,Санкт-Петербург,WebMasters Russia,"В B2C маркетинге, предпочтительно в",,,
IT инженер,https://hh.ru/vacancy/131976155?query=it&hhtmFrom=vacancy_search_list,Ханты-Мансийский автономный округ — Югра,ЭйчарОсы,Среднее или высшее техническое образование. Знание Linux или желание переобучиться с Windows на Linux. Опыт в аналогичной сфере не менее...,,,
Директор отдела IT,https://hh.ru/vacancy/131996174?query=it&hhtmFrom=vacancy_search_list,"Алматы, проспект Аль-Фараби, 77/7","ТОО Кэпитал Тауэр Девелопмент (The Ritz-Carlton, Almaty)",Technology Leadership & Strategy.,,"1 500 000 – 2 000 000 ₸ за месяц, до вычета налогов",
Директор отдела IT,https://hh.ru/vacancy/131996175?query=it&hhtmFrom=vacancy_search_list,"Алматы, проспект Аль-Фараби, 77/7","ТОО Кэпитал Тауэр Девелопмент (The Ritz-Carlton, Almaty)",Technology Leadership & Strategy.,,"1 500 000 – 2 000 000 ₸ за месяц, до вычета налогов",
Директор отдела IT,https://hh.ru/vacancy/131996176?query=it&hhtmFrom=vacancy_search_list,"Алматы, проспект Аль-Фараби, 77/7","ТОО Кэпитал Тауэр Девелопмент (The Ritz-Carlton, Almaty)",Technology Leadership & Strategy.,,"1 500 000 – 2 000 000 ₸ за месяц, до вычета налогов",
Руководитель IT,https://hh.ru/vacancy/130962525?query=it&hhtmFrom=vacancy_search_list,Москва,Аванта,Опыт руководства,,,
IT специалист,https://hh.ru/vacancy/131974680?query=it&hhtmFrom=vacancy_search_list,"Нукус, автомагистраль Нукус - Турткул, 1/2",ООО AKFA BUILDING MATERIALS. ИТ и SAP,Среднее специальное или высшее образование (,,,
IT Product owner,https://hh.ru/vacancy/131387659?query=it&hhtmFrom=vacancy_search_list,"Бишкек, улица Ивана Панфилова, 178",Sun IT,Использовать свой предыдущий опыт и предложить что-то новое - мы открыты для новых идей. Имеете опыт работы от 1 года...,,,
Системный / бизнес-аналитик (IT),https://hh.ru/vacancy/131397541?query=it&hhtmFrom=vacancy_search_list,Москва,StartUpix,"Сильные коммуникационные навыки (устные и письменные): умение ясно и структурно доносить мысли, выстраивать конструктивный диалог и фиксировать договорённости.",,"1 500 – 3 000 ₽ за час, на руки",
Таргетолог (IT/EdTech),https://hh.ru/vacancy/131879322?query=it&hhtmFrom=vacancy_search_list,"Алматы, улица Карасай батыра, 140","Нек. орг. Авторская Школа Жании Аубакировой, Учреждение",,,"от 150 000 ₸ за месяц, на руки",
IT-менеджер (отель),https://hh.ru/vacancy/130536851?query=it&hhtmFrom=vacancy_search_list,Москва,ООО АРБАТ ХОСПИТАЛИТИ,"Высшее профессиональное (техническое) образование. Знание английского языка - большое преимущество. Знание и опыт настройки серверов, сетевого оборудования. Опыт работы с MS...",,,
Аналитик IT,https://hh.ru/vacancy/131973481?query=it&hhtmFrom=vacancy_search_list,"Петрозаводск, Московская улица, 16",ГБУЗ Республики Карелия Республиканский медицинский информационно-аналитический центр,Знание систем управления базами данных. Уверенное владение SQL. Навыки фомирования выборки данных по сложным критериям. Опыт работы с реляционными СУБД.,,"46 000 – 47 000 ₽ за месяц, на руки",
Юрисконсульт IT / Юрист,https://hh.ru/vacancy/131994188?query=it&hhtmFrom=vacancy_search_list,Санкт-Петербург,ITG Corporation,"Сильные знания в области гражданского права, интеллектуальной собственности, законодательства о персональных данных, налогового законодательства, международного частного права. Навыки работы с...",,,
Администратор IT проектов,https://hh.ru/vacancy/131098510?query=it&hhtmFrom=vacancy_search_list,Москва,АО Государственная транспортная лизинговая компания,"Опыт работы на аналогичных позициях от 3-х лет. Знание проектного менеджмента (методология, методы, инструменты). Опыт ведения документооборота, работа в...",,,
Технический специалист / IT-специалист,https://hh.ru/vacancy/131887887?query=it&hhtmFrom=vacancy_search_list,Москва,ИП Бакулина Виктория Анатольевна,умеет автоматизировать процессы. * понимает бизнес-логику. Hard skills (обязательные). * опыт работы с **1С Комплексная автоматизация. * опыт работы с 1...,,"от 100 000 ₽ за месяц, на руки",
Технический специалист (IT),https://hh.ru/vacancy/131260491?query=it&hhtmFrom=vacancy_search_list,Алматы,Sulpak,Опыт не нужен — всему научим с нуля. Чем будешь заниматься: Если есть опыт или образование в,,,
Техник монтажник (it),https://hh.ru/vacancy/131821402?query=it&hhtmFrom=vacancy_search_list,Усть-Каменогорск,ТОО Сей-Нар,"Средне-специальное техническое профильное образование. Грамотная речь, вежливость и пунктуальность, управление конфликтами, навыки общения с простыми пользователями. Обучаемость, умение работать...",,,
IT-специалист,https://hh.ru/vacancy/131186392?query=it&hhtmFrom=vacancy_search_list,"Актау, микрорайон 3Б, 55/1",ТОО ADVER.KZ,"Администрирование сетевого оборудования Mikrotik. Отличное понимание модели OSI и TCP/IP. Маршрутизация: static routes. Коммутация: VLAN, trunk. NAT. DHCP, DNS.",,"от 250 000 ₸ за месяц, на руки",
IT-Инженер (Системный администратор),https://hh.ru/vacancy/132001467?query=it&hhtmFrom=vacancy_search_list,"Воронеж, р-н Ленинский",ООО Би Ай Решения,Опыт администрирования серверов на Windows Server (2016/2019/2022) и Linux (Ubuntu/Debian/CentOS). Уверенная работа с виртуальными машинами: Hyper...,,"от 55 000 ₽ за месяц, на руки",
Инженера проектировщика IT-систем,https://hh.ru/vacancy/132001220?query=it&hhtmFrom=vacancy_search_list,Москва,ООО ЧЕСКА,Знание современного оборудования и решений для,,,
Юрист IT (Цифровой рубль),https://hh.ru/vacancy/131210205?query=it&hhtmFrom=vacancy_search_list,"Москва, р-н Мещанский",Центральный банк Российской Федерации (Банк России),"Опыт работы по юридической специальности в области правового регулирования информационных технологий, цифровых решений, искусственного интеллекта, в частности в",,,
Руководитель IT отдела,https://hh.ru/vacancy/128866673?query=it&hhtmFrom=vacancy_search_list,Москва,ООО КомСтрой,"Высшее образование. Опыт работы системным администратором не менее 5 лет, в должности руководителя отдела/группы от 2х лет.",,"150 000 – 200 000 ₽ за месяц, на руки",
Инженера проектировщика IT-систем,https://hh.ru/vacancy/132001220?query=it&hhtmFrom=vacancy_search_list,Москва,ООО ЧЕСКА,Знание современного оборудования и решений для,,,
Юрист IT (Цифровой рубль),https://hh.ru/vacancy/131210205?query=it&hhtmFrom=vacancy_search_list,"Москва, р-н Мещанский",Центральный банк Российской Федерации (Банк России),"Опыт работы по юридической специальности в области правового регулирования информационных технологий, цифровых решений, искусственного интеллекта, в частности в",,,
Руководитель IT отдела,https://hh.ru/vacancy/128866673?query=it&hhtmFrom=vacancy_search_list,Москва,ООО КомСтрой,"Высшее образование. Опыт работы системным администратором не менее 5 лет, в должности руководителя отдела/группы от 2х лет.",,"150 000 – 200 000 ₽ за месяц, на руки",
Спикер направления IT,https://hh.ru/vacancy/131987706?query=it&hhtmFrom=vacancy_search_list,Москва,Ventra,"География: Россия, Казахстан, Узбекистан, Беларусь. Публичность внутри крупного",,,
Менеджер проекта (IT/Digital),https://hh.ru/vacancy/131394244?query=it&hhtmFrom=vacancy_search_list,"Москва, р-н Тверской",ARK,Высшее образование и опыт работы от 3 лет в управлении,,,
Руководитель отдела IT,https://hh.ru/vacancy/131986522?query=it&hhtmFrom=vacancy_search_list,"Пермь, р-н Дзержинский",Автомобильный холдинг Экскурс,...практик организации,,"120 000 – 150 000 ₽ за месяц, на руки",
Менеджер IT проектов,https://hh.ru/vacancy/131986493?query=it&hhtmFrom=vacancy_search_list,Москва,ООО PepsiCo,"Опыт работы в управлении проектами более 3 лет, предпочтительно в сфере ИТ, digital или transformation. Опыт реализации региональных проектов, включая...",,,
Менеджер по продажам (IT),https://hh.ru/vacancy/131998462?query=it&hhtmFrom=vacancy_search_list,"Москва, р-н Пресненский",ООО Сентал,Экспертиза в,,,
IT-рекрутер (Gamedev),https://hh.ru/vacancy/131699547?query=it&hhtmFrom=vacancy_search_list,Минск,Леста Игры,"Опыт рекрутинга в геймдеве не менее 3 лет (работа со стримами арт / разработка / инфраструктура). Умение приоритизировать и структурировать задачи, эффективно...",,,
Инженер технической поддержки IT,https://hh.ru/vacancy/131996593?query=it&hhtmFrom=vacancy_search_list,Москва,Авилон Автомобильная Группа,"Знание перечня основных и второстепенных элементов ИТ инфраструктуры. Знание ПК на уровне администратора. Работа с основным ПО АРМ (ОС, Офисный...",,"104 000 ₽ за месяц, на руки",
Специалист группы IT,https://hh.ru/vacancy/131983733?query=it&hhtmFrom=vacancy_search_list,"Уфа, р-н Орджоникидзевский",Филиал ПАО АНК Башнефть Башнефть-УНПЗ,"Высшее профессиональное (техническое), среднее профессиональное образование. С высшим профессиональным образованием без предъявления требований к стажу. Со средним профессиональным образованием, опыт...",,"45 000 – 52 000 ₽ за месяц, на руки",
Менеджер по продажам в IT,https://hh.ru/vacancy/129295584?query=it&hhtmFrom=vacancy_search_list,Казань,MarketGuru,"Успешный опыт в продажах от 1 года. Умение продавать, знание техник продаж. Желание обучаться и становиться лучше. Умение самостоятельно организовывать...",,"от 120 000 ₽ за месяц, до вычета налогов",
Менеджер IT-проектов,https://hh.ru/vacancy/131534574?query=it&hhtmFrom=vacancy_search_list,Москва,АНО ЦИСМ,Опыт от 2-х лет в управлении,,,
Системный администратор / IT специалист,https://hh.ru/vacancy/131710320?query=it&hhtmFrom=vacancy_search_list,"Уфа, р-н Кировский",ООО МобилБетон,высшее образование. -опыт работы от 3х лет.,,"90 000 – 100 000 ₽ за месяц, до вычета налогов",
Руководитель отдела IT-инфраструктуры,https://hh.ru/vacancy/131547110?query=it&hhtmFrom=vacancy_search_list,Санкт-Петербург,The AnyLogic Company,Зоны ответственности: - Более 5 лет hands-on опыта с System Operations / DevOps. - Опыт руководства инженерными командами. - Опыт продуктовой разработки и...,,,
IT-Мастер / Начинающий мастер ПК,https://hh.ru/vacancy/131438004?query=it&hhtmFrom=vacancy_search_list,Санкт-Петербург,ООО Ок Комфорт-Сервис,,,"от 140 000 ₽ за месяц, на руки",
