title,link,address,company,short_description,rich_description,salary,skils
"Руководитель проектов (IT, страховой продукт)",https://hh.ru/vacancy/131581344?query=it&hhtmFrom=vacancy_search_list,"Москва, р-н Марьина Роща",ИП Мамаева Ирина Анатольевна,Опыт управления проектами в сфере разработки ПО. Понимание принципов и этапов разработки программного обеспечения (жизненного цикла ПО). Опыт координации или...,,"до 300 000 ₽ за месяц, на руки",
Ведущий менеджер по продажам IT оборудования (производитель оборудования и программных решений),https://hh.ru/vacancy/131960114?query=it&hhtmFrom=vacancy_search_list,Москва,Сервис Плюс,Любите продажи и готовы работать с крупными клиентами. Подтвержденный опыт B2B продаж напрямую заказчикам (торговым сетям).,,,
Head of IT Recruitment & HRBP,https://hh.ru/vacancy/131305961?query=it&hhtmFrom=vacancy_search_list,Минск,ООО Губанова и Партнеры,Опыт работы в,,"от 5 500 Br за месяц, на руки",
Ассистент преподавателя в детской IT-школе,https://hh.ru/vacancy/131931232?query=it&hhtmFrom=vacancy_search_list,"Александров, улица Свердлова, 34",ИП Модов Сергей Александрович,"Тебе нравится работать с детьми, и ты легко находишь с ними общий язык. Ты ответственный, инициативный и легко обучаемый.",,,
Региональный представитель в IT,https://hh.ru/vacancy/131441472?query=it&hhtmFrom=vacancy_search_list,Новосибирск,ООО ДАКОМ М,"Высшее образование. Отличные коммуникативные навыки, умение вести переговоры и убеждать. Знание и понимание специфики ИТ отрасли. Целеустремленность и ориентированность на...",,,
Менеджер по продажам IT-решений,https://hh.ru/vacancy/131470693?query=it&hhtmFrom=vacancy_search_list,"Оренбург, р-н Дзержинский",1С-Коннект,...х лет (работа в сфере B2B или с,,"от 80 000 ₽ за месяц, на руки",
Офис-менеджер (в IT-компанию),https://hh.ru/vacancy/131471347?query=it&hhtmFrom=vacancy_search_list,Москва,ООО Колл-Тулз,"Опыт работы в качестве секретаря, помощника руководителя, ассистента, офис-менеджера будет плюсом. Навыки уверенного пользователя ПК, оргтехники. Знание основных офисных...",,,
Менеджер по продажам B2B (IT-продукт),https://hh.ru/vacancy/131572499?query=it&hhtmFrom=vacancy_search_list,Москва,Центр финансовых технологий,Интерес развиваться в сфере ИТ-продуктов и финтех-решений. Проактивность и нацеленность на результат. Желание учиться новому и развиваться.,,"от 100 000 ₽ за месяц, на руки",
Менеджер по продажам в IT-компании (без поиска клиентов),https://hh.ru/vacancy/75862402?query=it&hhtmFrom=vacancy_search_list,Москва,"ЭЛКОД, группа компаний",Коммуникабельность: Умение устанавливать контакт и легко общаться с клиентами. Умение слушать: Важно понимать и выявлять потребности клиентов и предлагать им...,,,
Менеджер по продажам в IT,https://hh.ru/vacancy/129850626?query=it&hhtmFrom=vacancy_search_list,Нижний Новгород,ООО Альфа,"Опыт в В2В продажах, но даже если его нет то готовы обучать. Активная, энергичная жизненная позиция.",,,
Директор по продажам (IT/ИБ),https://hh.ru/vacancy/131743376?query=it&hhtmFrom=vacancy_search_list,"Москва, р-н Останкинский",Avanpost,"Успешный практический опыт продаж программного обеспечения, инфраструктуры и сервисов, сервисов ИБ, опыт работы в отделе продаж вендора или системного интегратора...",,,
Руководитель направления / менеджер по работе с корпоративными it клиентами,https://hh.ru/vacancy/131649249?query=it&hhtmFrom=vacancy_search_list,Москва,ООО Итон,Наличие собственной активной клиентской базы — важное преимущество. Опыт работы в,,,
Руководитель IT отдела (сервисные инженеры),https://hh.ru/vacancy/131739957?query=it&hhtmFrom=vacancy_search_list,"Рязань, р-н Советский",ООО Мультибит,Опыт: Опыт работы на руководящей должности в,,"90 000 – 130 000 ₽ за месяц, на руки",
Координатор IT-отдела,https://hh.ru/vacancy/131876021?query=it&hhtmFrom=vacancy_search_list,Москва,ООО Объединенные кондитеры,"Опыт работы в аналогичной должности: не менее 1 года. Знание деловой этики и стандарта деловых коммуникаций, навык делового письма.",,,
AI Tech Recruiter / IT-рекрутер,https://hh.ru/vacancy/131912965?query=it&hhtmFrom=vacancy_search_list,Москва,Думатель,Опыт,,"от 150 000 ₽ за месяц, на руки",
Ассистент/ Начинающий специалист в отдел технической поддержки / HelpDesk/ IT,https://hh.ru/vacancy/131128812?query=it&hhtmFrom=vacancy_search_list,Москва,ПОТОК,Грамотный русский язык. Умение объяснять сложные процессы простым языком и понятно доносить свою мысль. Уверенное владение ПК. Умение находить общий...,,,
Менеджер по продажам / РОП в IT‑агентство Sumnikoff IT Group,https://hh.ru/vacancy/131912529?query=it&hhtmFrom=vacancy_search_list,"Анапа, улица 40 лет Победы, 1Б",ИП Сумников Илья Алексеевич,"Есть опыт продаж цифровых услуг (сайты, CRM, SEO, SMM, реклама,",,,
Менеджер IT-проектов (Project Manager),https://hh.ru/vacancy/131300571?query=it&hhtmFrom=vacancy_search_list,Новосибирск,SHIKcosmetics,Опыт управления проектами в,,,
Менеджер по продажам IT-решений,https://hh.ru/vacancy/124067425?query=it&hhtmFrom=vacancy_search_list,"Волгоград, р-н Центральный",Интегрикс,Понимание трендов,,"от 100 000 ₽ за месяц, до вычета налогов",
Менеджер по продажам в IT-компанию с собственным производством (КОМПИТ),https://hh.ru/vacancy/131501774?query=it&hhtmFrom=vacancy_search_list,Москва,ООО Компит Про,"Высокая обучаемость: готов быстро разбираться в номенклатуре продукции компании и нюансах законодательства. ! Нацеленность на результат: нам нужны закрытые контракты, а...",,"100 000 – 150 000 ₽ за месяц, на руки",
IT рекрутер (Middle),https://hh.ru/vacancy/131867717?query=it&hhtmFrom=vacancy_search_list,"Ташкент, улица Батыра Закирова, 2А",АКБ Агробанк,Опыт работы с,,,
Дежурный инженер (Hot Line) / IT Support Engineer (L2),https://hh.ru/vacancy/131937052?query=it&hhtmFrom=vacancy_search_list,Ташкент,ООО International Foodchain,Опыт,,,
Заместитель руководителя технического и IT отделов,https://hh.ru/vacancy/131223565?query=it&hhtmFrom=vacancy_search_list,"Пермь, р-н Ленинский",ООО Рус импорт,Высшее техническое образование (,,,
Менеджер по продажам IT-сервис,https://hh.ru/vacancy/131909239?query=it&hhtmFrom=vacancy_search_list,Астрахань,ООО Джусап,Опыт в продажах от 1 года. Умение делать от 90 наборов и 120 минут на линии в день.,,"120 000 – 150 000 ₽ за месяц, до вычета налогов",
Менеджер по продажам IT-оборудования,https://hh.ru/vacancy/130562407?query=it&hhtmFrom=vacancy_search_list,Москва,ОГО! онлайн-гипермаркет,Опыт работы в продажах,,"от 200 000 ₽ за месяц, на руки",
Менеджер по продажам в IT-компанию,https://hh.ru/vacancy/129772869?query=it&hhtmFrom=vacancy_search_list,Санкт-Петербург,ООО АйТи-Солюшн,...продажах и влиять на свой доход. Способность к обучению и освоению нового. Клиентоориентированность. Системное мышление. Опыт продаж в,,,
Менеджер по продажам (сфера IT),https://hh.ru/vacancy/131295879?query=it&hhtmFrom=vacancy_search_list,Оренбург,Simple Digital,Знания и опыт продаж в сегменте B2B от 1 года. Опыт работы в Битрикс24. Способность расположить к...,,,
Начинающий специалист технической поддержки L2 (IT) / 2 уровень технической поддержки,https://hh.ru/vacancy/131955492?query=it&hhtmFrom=vacancy_search_list,Санкт-Петербург,Evercode Lab,Готовность быстро осваивать продукт и постоянно учиться новому. Желание развиваться в,,,
Ведущий системный администратор/Руководитель IT-отдела,https://hh.ru/vacancy/130412260?query=it&hhtmFrom=vacancy_search_list,"Санкт-Петербург, р-н Приморский",ООО Медико-фармацевтический дистрибьютор,Высшее образование по профилю. Опыт работы системным администратором от 3-х лет. Опыт руководства группой сотрудников в т.ч.,,,
Менеджер продукта (Product Manager в IT),https://hh.ru/vacancy/131590436?query=it&hhtmFrom=vacancy_search_list,Москва,ООО Колл-Тулз,Формирование и внедрение бизнес и продуктовых метрик. Выстраивание аналитики по продукту. Организация процесса A/B-тестирования. Понимание жизненного цикла разработки...,,,
"Менеджер по продажам (IT, ИБ)",https://hh.ru/vacancy/131293059?query=it&hhtmFrom=vacancy_search_list,Астана,КСК-Эйч Ар,Опыт работы в продажах,,,
Менеджер по продажам IT продуктов,https://hh.ru/vacancy/131905279?query=it&hhtmFrom=vacancy_search_list,"Волгоград, р-н Центральный",ООО Такском,"Желание строить карьеру в сфере продаж. Готовность к обучению, опыт в продажах приветствуется, но мы всему научим! Грамотная устная и...",,"от 70 000 ₽ за месяц, на руки",
Ведущий системный администратор/Руководитель IT-отдела,https://hh.ru/vacancy/130412260?query=it&hhtmFrom=vacancy_search_list,"Санкт-Петербург, р-н Приморский",ООО Медико-фармацевтический дистрибьютор,Высшее образование по профилю. Опыт работы системным администратором от 3-х лет. Опыт руководства группой сотрудников в т.ч.,,,
Менеджер продукта (Product Manager в IT),https://hh.ru/vacancy/131590436?query=it&hhtmFrom=vacancy_search_list,Москва,ООО Колл-Тулз,Формирование и внедрение бизнес и продуктовых метрик. Выстраивание аналитики по продукту. Организация процесса A/B-тестирования. Понимание жизненного цикла разработки...,,,
"Менеджер по продажам (IT, ИБ)",https://hh.ru/vacancy/131293059?query=it&hhtmFrom=vacancy_search_list,Астана,КСК-Эйч Ар,Опыт работы в продажах,,,
Менеджер по продажам IT продуктов,https://hh.ru/vacancy/131905279?query=it&hhtmFrom=vacancy_search_list,"Волгоград, р-н Центральный",ООО Такском,"Желание строить карьеру в сфере продаж. Готовность к обучению, опыт в продажах приветствуется, но мы всему научим! Грамотная устная и...",,"от 70 000 ₽ за месяц, на руки",
Специалист по работе с информационной системой в IT-компании (специалист технической поддержки),https://hh.ru/vacancy/131515251?query=it&hhtmFrom=vacancy_search_list,"Пермь, р-н Индустриальный",ООО ИТМС,"Грамотная устная и письменная речь, умение доступно сформулировать и описать сложные решения. Пунктуальность, ответственность. Уверенный пользователь ПК. Опыт работы в...",,"до 65 000 ₽ за месяц, на руки",
"Менеджер по закупкам (IT-оборудование, Китай)",https://hh.ru/vacancy/131756923?query=it&hhtmFrom=vacancy_search_list,Москва,Айти-тех,Имеете опыт в проектных закупках,,"70 000 – 150 000 ₽ за месяц, на руки",
Scan-оператор на IT-склад,https://hh.ru/vacancy/131459947?query=it&hhtmFrom=vacancy_search_list,Москва,ЭЛИЯ,Приходить на смену вовремя. Уметь работать в команде. Выполнять задачи ответственно (перфекционизм не обязателен). Быть внимательным и пунктуальным.,,"до 150 000 ₽ за месяц, на руки",
Менеджер по продажам IT-решений Росэлторг.Бизнес,https://hh.ru/vacancy/128283294?query=it&hhtmFrom=vacancy_search_list,Москва,РОСЭЛТОРГ,"Опыт в продажах SaaS-решений. Опыт в продажах (B2C, B2B услуг и сервисов). Опыт в телефонных...",,"от 180 000 ₽ за месяц, до вычета налогов",
Менеджер по продажам (IT-программа),https://hh.ru/vacancy/131409778?query=it&hhtmFrom=vacancy_search_list,"Ярославль, р-н Ленинский",ООО Единый центр информации,"Опыт работы в продажах (B2B, продажа услуг, телефонные продажи) от 1 года будет вашим преимуществом.",,,
Руководитель IT проектов,https://hh.ru/vacancy/119227637?query=it&hhtmFrom=vacancy_search_list,Санкт-Петербург,СОЛВО,"Опытом внедрения ПО корпоративного уровня в качестве менеджера проекта. Пониманием процессов разработки ПО. Развитыми коммуникативными навыками, умением вести переговоры с...",,,
"Менеджер по работе с клиентами (аккаунт, b2b, IT-продукт)",https://hh.ru/vacancy/131952874?query=it&hhtmFrom=vacancy_search_list,"Москва, р-н Крылатское",CТОTEK,"Настроенных на результат. Готовых общаться с собственниками и директорами. Тех, кто умеет быть настойчивым и вежливым одновременно. Проактивных и заряженных...",,"95 000 – 140 000 ₽ за месяц, на руки",
Главный специалист-аналитик IT- проектов,https://hh.ru/vacancy/131280451?query=it&hhtmFrom=vacancy_search_list,"Челябинск, р-н Центральный",Областное государственное бюджетное учреждение Челябинский региональный центр навигационно-информационных технологий,Высшее законченное образование (преимущество кандидатам с,,"от 45 000 ₽ за месяц, до вычета налогов",
Финансовый партнер по контролю IT-расходов,https://hh.ru/vacancy/131928735?query=it&hhtmFrom=vacancy_search_list,Москва,АО Банк ДОМ.РФ Другие подразделения,Высшее образование (экономика/финансы). Продвинутый уровень Excel. Приветствуется опыт работы в Банках/консалтинговых/аудиторских компаниях. Работа в финансах / финансовом контроллинге.,,,
"Маркетолог (B2B, IT-направление)",https://hh.ru/vacancy/131430032?query=it&hhtmFrom=vacancy_search_list,Алматы,ТОО ИТ Компьютерс,"Высшее образование (техническое или маркетинговое). Приветствуется знание рынка телекоммуникационного, серверного и",,,
IT менеджер CRM проектов,https://hh.ru/vacancy/131156336?query=it&hhtmFrom=vacancy_search_list,Москва,ICNX,Опыт от 3-х лет на позиции менеджера проектов либо аккаунт менеджера в,,,
Менеджер по продажам (Enterprise / IT),https://hh.ru/vacancy/130593604?query=it&hhtmFrom=vacancy_search_list,"Москва, р-н Таганский",Первая Форма,"Важно! Обязателен опыт проектных продаж сложного ПО: BPM, CRM, SRM, HRM, WMS или других enterprise-решений.",,,
IT-менеджер по продажам 1С,https://hh.ru/vacancy/131927358?query=it&hhtmFrom=vacancy_search_list,Нижний Новгород,1С:Апрель Софт,Активность и готовность к изучению большого объема информации. - Заинтересованность развиваться в сфере продаж. -,,,
"Product marketing manager / Продуктовый маркетолог (IT, B2B, Fintech)",https://hh.ru/vacancy/131603122?query=it&hhtmFrom=vacancy_search_list,Москва,ИП Мамаева Ирина Анатольевна,Опыт в создании Fintech-решений для Affiliate-маркетинга и рекламной индустрии - более 11 лет. 1 по ряду направлений в русскоязычных...,,"до 300 000 ₽ за месяц, на руки",
Менеджер по продажам (IT-продукт),https://hh.ru/vacancy/131289779?query=it&hhtmFrom=vacancy_search_list,Москва,ИП Власенков Роман Владимирович,Коммуникативные навыки - грамотное общение с клиентами и внутри коллектива. Желание работать и зарабатывать.,,"60 000 – 100 000 ₽ за месяц, на руки",
Менеджер по продажам B2B-SaaS IT / Sales manager,https://hh.ru/vacancy/131707898?query=it&hhtmFrom=vacancy_search_list,Москва,ООО Мисти Групп,"Опыт успешных продаж B2B SaaS-продуктов (обязательно!). Опыт работы с CRM (желательно amoCRM). Умение проводить презентации, демонстрации, отвечать...",,,
Руководитель отдела продаж ( IT / сайты),https://hh.ru/vacancy/131900945?query=it&hhtmFrom=vacancy_search_list,Екатеринбург,Neat-Studio,Опыт управления отделом продаж от 2–3 лет (желательно в,,"до 180 000 ₽ за месяц, на руки",
Водитель на иномарку компании в IT-холдинг (Категории B),https://hh.ru/vacancy/131642999?query=it&hhtmFrom=vacancy_search_list,"Тула, р-н Пролетарский",ООО ГРУЗМАСТЕР,"Права категории B. Стаж от 1 года. Нормальное, аккуратное вождение.",,"до 139 000 ₽ за месяц, до вычета налогов",
Водитель на иномарку компании в IT-холдинг (Категории B),https://hh.ru/vacancy/131643000?query=it&hhtmFrom=vacancy_search_list,"Пенза, р-н Первомайский",ООО ГРУЗМАСТЕР,"Права категории B. Стаж от 1 года. Нормальное, аккуратное вождение.",,"до 139 000 ₽ за месяц, до вычета налогов",
Администратор IT департамента,https://hh.ru/vacancy/131138209?query=it&hhtmFrom=vacancy_search_list,"Москва, р-н Останкинский",AUVIX,"Аналогичный опыт работы в качестве менеджера / помощника / координатора. Общее понимание номенклатуры ИТ оборудования. Опыт работы с системами учета, CRM, ЭДО.",,,
"Менеджер по продажам IT-оборудования / B2B (сервера, СХД)",https://hh.ru/vacancy/131940537?query=it&hhtmFrom=vacancy_search_list,"Москва, р-н Донской",ИП Пахотина Ксения Евгеньевна,Опыт продаж,,"от 200 000 ₽ за месяц, на руки",
Юрист онлайн-бизнеса / IT-проектов,https://hh.ru/vacancy/131898580?query=it&hhtmFrom=vacancy_search_list,"Новосибирск, р-н Железнодорожный",Ксения Петренко - Юрист для бизнеса,Практический опыт работы с онлайн-бизнесом. Понимание специфики,,"от 80 000 ₽ за месяц, на руки",
Юрист онлайн-бизнеса / IT-проектов,https://hh.ru/vacancy/131898581?query=it&hhtmFrom=vacancy_search_list,"Новосибирск, р-н Железнодорожный",Ксения Петренко - Юрист для бизнеса,Практический опыт работы с онлайн-бизнесом. Понимание специфики,,"от 80 000 ₽ за месяц, на руки",
Администратор IT проектов (офис-менеджер),https://hh.ru/vacancy/131544235?query=it&hhtmFrom=vacancy_search_list,Москва,ФГАОУ ВО РОССИЙСКИЙ НАЦИОНАЛЬНЫЙ ИССЛЕДОВАТЕЛЬСКИЙ МЕДИЦИНСКИЙ УНИВЕРСИТЕТ им.Н.И. ПИРОГОВА МИНИСТЕРСТВА ЗДРАВООХРАНЕНИЯ РОССИЙСКОЙ ФЕДЕРАЦИИ,"Образование высшее (приоритет - государственное управления, менеджмент) или среднее профессиональное (приоритет - колледж МИД РФ). Возможен вариант, если вы в процессе получения...",,"до 90 000 ₽ за месяц, на руки",
Начинающий сотрудник в IT-компанию,https://hh.ru/vacancy/131901069?query=it&hhtmFrom=vacancy_search_list,"Тула, р-н Центральный",UltraCOM,Внимание и высокая концентрация. Аналитический склад ума. Усидчивость. Грамотная речь.,,,
