title,link,address,company,short_description,rich_description,salary,skils
"Главный бухгалтер (IT-компания, резидент IT Park)",https://hh.ru/vacancy/131333976?query=it&hhtmFrom=vacancy_search_list,Ташкент,ООО TALENT LAB,"...и сдачи отчетности, уверенное владение 1С и Excel, внимательность, аккуратность, высокий уровень ответственности. Опыт работы в",,,
Менеджер по продажам IT,https://hh.ru/vacancy/131956786?query=it&hhtmFrom=vacancy_search_list,Москва,ООО Никадел,"Что будешь делать ты: - Активной жизненной позиции, уверенности в себе! - Ответственности, обучаемости, исполнительности. - Грамотной устной и письменной речи, умения выявлять...",,"60 000 – 150 000 ₽ за месяц, на руки",
Менеджер по продаже образовательных продуктов (IT / AI / GPT / Soft Skills),https://hh.ru/vacancy/131859049?query=it&hhtmFrom=vacancy_search_list,Москва,xHuman Sales,"Юный предприниматель (обучаем финансовой грамотности и управлению проектами). Искусственный Интеллект (обучаем писать ПРОМТы, использовать ИИ в учебе и жизни).",,"200 000 – 300 000 ₽ за месяц, на руки",
Специалист по тендерам (IT оборудование),https://hh.ru/vacancy/131680718?query=it&hhtmFrom=vacancy_search_list,Москва,NOC Technology,Опыт работы с коммерческими закупками (предпочтительно,,"от 120 000 ₽ за месяц, на руки",
Бизнес-аналитик в IT,https://hh.ru/vacancy/131787711?query=it&hhtmFrom=vacancy_search_list,Санкт-Петербург,Delaweb,Опыт работы бизнес-аналитиком в заказной разработке разных проектов в,,"150 000 – 200 000 ₽ за месяц, на руки",
IT Аудитор,https://hh.ru/vacancy/131925069?query=it&hhtmFrom=vacancy_search_list,"Алматы, улица Ади Шарипова, 90",Kaspi.kz,"Опыт работы с администрированием операционных системам (Windows, Linux). Базовое понимание работы Active Directory. Базовое понимание работы реляционных БД (Oracle, MSSQL).",,,
IT Директор,https://hh.ru/vacancy/131476864?query=it&hhtmFrom=vacancy_search_list,Москва,Drhead,Опыт работы,,,
Руководитель отдела IT-инфраструктуры,https://hh.ru/vacancy/131956799?query=it&hhtmFrom=vacancy_search_list,Москва,Крупная FMCG компания,"Высшее техническое образование. Опыт работы с конфигурациями 1С (УТ, УПП, Рарус) для управления розничными магазинами. Опыт работы в ИТ...",,,
IT менеджер,https://hh.ru/vacancy/131923140?query=it&hhtmFrom=vacancy_search_list,"Астана, проспект Мангилик Ел, 35А",АО Dosjan temir joly,Опыт работы не менее 5 лет в сфере системного администрирования и,,,
"Менеджер по работе с клиентами (B2B, 1С, IT-услуги)",https://hh.ru/vacancy/131871171?query=it&hhtmFrom=vacancy_search_list,Москва,ООО Ю-Софт Ритейл,"Опыт и знания: Образование не ниже среднего профессионального. Высокий уровень эмпатии и клиентоориентированности. Отличные коммуникативные навыки, грамотная устная и письменная...",,"60 000 – 120 000 ₽ за месяц, до вычета налогов",
Начинающий специалист (IT-компания),https://hh.ru/vacancy/131956286?query=it&hhtmFrom=vacancy_search_list,Москва,ООО Крипто-Сервис,"Техническое образование или опыт в ИТ/ИБ сфере будет преимуществом (не обязательно, есть обучение). Военный билет или действующее приписное свидетельство...",,,
IT-специалист,https://hh.ru/vacancy/131791600?query=it&hhtmFrom=vacancy_search_list,"Владимир, р-н Октябрьский",ГКУ ВО ГОСЮРБЮРО,Базовые знания в области,,"20 000 – 25 000 ₽ за месяц, до вычета налогов",
IT-специалист по ремонту компьютеров | Ассистент мастера по ремонту ПК,https://hh.ru/vacancy/131371880?query=it&hhtmFrom=vacancy_search_list,Москва,Апгрейд-Сервис,"Опыт работы приветствуется, но не обязателен! Особенно ценятся кандидаты с предыдущими местами работы в известных компаниях:",,"180 000 – 250 000 ₽ за месяц, на руки",
"Менеджер по продажам IT (B2B, B2G)",https://hh.ru/vacancy/131897130?query=it&hhtmFrom=vacancy_search_list,Москва,ООО Цифровые технологии,"Готовность работать с документацией и расчетами. Ответственность, самостоятельность, ориентация на результат. Будет плюсом: опыт работы в",,"от 115 000 ₽ за месяц, до вычета налогов",
Бизнес / фуллстэк аналитик (IT),https://hh.ru/vacancy/131666408?query=it&hhtmFrom=vacancy_search_list,Новосибирск,NAN,"Коммерческий опыт в роли бизнес / системного / фуллстэк аналитика - от 3х лет. Опыт самостоятельного сбора и формализации требований заказчика, умение...",,,
Заместитель начальника IT отдела,https://hh.ru/vacancy/131954797?query=it&hhtmFrom=vacancy_search_list,Санкт-Петербург,АО ЗАСЛОН,Высшее образование. Опыт работы по организации и управлению работы ИТ-подразделения. Комплексный подход и своевременная отчётность. Гибкость и умение найти...,,,
IT специалист,https://hh.ru/vacancy/131132352?query=it&hhtmFrom=vacancy_search_list,"Мытищи, Силикатная улица, 19",ООО Фенсстрой,"Опыт работы в качестве системного администратора или сотрудника техподдержки. Опыт разработки или администрирования сайтов (Желательно). Системное мышление, умение абстрагировать и...",,"60 000 – 100 000 ₽ за месяц, на руки",
Менеджер по продажам (В2В )в IT компанию,https://hh.ru/vacancy/131686008?query=it&hhtmFrom=vacancy_search_list,"Ташкент, Юнусабадский район, массив Юнусабад, 12-й квартал, 20A",ООО UYSOT TEAM,Опыт работы в B2B‑продажах от 1 года. Умение убеждать и доводить сделки до результата. Отличное знание узбекского...,,"9 000 000 – 18 000 000 so'm за месяц, до вычета налогов",
Начальник отдела IT технологий,https://hh.ru/vacancy/131665972?query=it&hhtmFrom=vacancy_search_list,Москва,VITASPORT,Высшее образование. Опыт работы от 3 лет.,,"от 177 000 ₽ за месяц, до вычета налогов",
Проджект менеджер / Руководитель проекта IT,https://hh.ru/vacancy/131966883?query=it&hhtmFrom=vacancy_search_list,Москва,СИНЕРГИЯ,Опыт управления креативными и,,"180 000 – 200 000 ₽ за месяц, на руки",
Начальник отдела IT технологий,https://hh.ru/vacancy/131665972?query=it&hhtmFrom=vacancy_search_list,Москва,VITASPORT,Высшее образование. Опыт работы от 3 лет.,,"от 177 000 ₽ за месяц, до вычета налогов",
Проджект менеджер / Руководитель проекта IT,https://hh.ru/vacancy/131966883?query=it&hhtmFrom=vacancy_search_list,Москва,СИНЕРГИЯ,Опыт управления креативными и,,"180 000 – 200 000 ₽ за месяц, на руки",
Технический директор / IT департамент,https://hh.ru/vacancy/131783133?query=it&hhtmFrom=vacancy_search_list,"Бишкек, улица Насирдина Исанова, 105/3",ОсОО ОСМП,Среднее профессиональное или высшее техническое образование либо наличие одного из сертификатов: CISA / CISM / CISSP / ITIL / COBIT. Опыт работы в сфере...,,,
Вожатый образовательного IT лагеря,https://hh.ru/vacancy/131953207?query=it&hhtmFrom=vacancy_search_list,"Краснодар, р-н Западный",Skyeng,Учишься или уже получил(а) образование (педагогика/психология — плюс). Любишь взаимодействие с детьми и умеешь их вовлекать. Спокойно реагируешь на...,,,
Сборщик товара с ТСД на теплый мини склад в IT компанию Яндекс (кладовщик комплектовщик),https://hh.ru/vacancy/129716788?query=it&hhtmFrom=vacancy_search_list,Санкт-Петербург,Найм персонал PRO,"НЕ ПРОДУКТЫ - медкнижка не нужна). (без штрафов, спокойный темп)!. Перемещать лёгкие коробки по складу на тележке — спортзал не нужен!",,"от 170 000 ₽ за месяц, на руки",
"Менеджер по продажам IT-решений (B2B, B2G)",https://hh.ru/vacancy/130556604?query=it&hhtmFrom=vacancy_search_list,Москва,ООО Труено Групп,Опыт в B2B/B2G-продажах в сфере,,"150 000 – 400 000 ₽ за месяц, до вычета налогов",
Менеджер по продажам IT - решений,https://hh.ru/vacancy/131966468?query=it&hhtmFrom=vacancy_search_list,Москва,Первый Бит,Понимаешь как работают продажи. - Любишь вызовы - возражения клиентов только разжигают азарт.,,"от 100 000 ₽ за месяц, до вычета налогов",
Системный администратор/IT-специалист,https://hh.ru/vacancy/131951969?query=it&hhtmFrom=vacancy_search_list,Санкт-Петербург,ООО БалтФрут-Северная Столица,Знания по работе с ЭЦП. Требования: Опыт работы системным администратором от 3-х лет. Знание операционных систем Windows и Linux.,,"от 100 000 ₽ за месяц, на руки",
IT-специалист,https://hh.ru/vacancy/131917252?query=it&hhtmFrom=vacancy_search_list,"Минусинск, Крекерная улица, 8",ООО МАГ Девелопмент,Опыт работы с пользователями разной степени подготовки. Базовые навыки диагностики неисправностей. Знание ОС Windows 10/11 на уровне администратора.,,"до 120 000 ₽ за месяц, на руки",
Ассистент руководителя IT-компании,https://hh.ru/vacancy/131951858?query=it&hhtmFrom=vacancy_search_list,"Чебоксары, улица Василия Алендея, 7",ООО Блэк Виар,"фиксировать задачи, напоминать по дедлайнам, дожимать мелкие хвосты до результата. — быстро разбирать входящие задачи от руководителя и превращать их в...",,"40 000 – 80 000 ₽ за месяц, до вычета налогов",
Sotuv menejer IT akademyasiga,https://hh.ru/vacancy/131501825?query=it&hhtmFrom=vacancy_search_list,"Ташкент, улица Муминова, 7/2",ООО IT TA`LIM BERISH MARKAZI USTUDY,"Кунига 70–100 та қўнғироқ қила оладиган. Мижознинг оғриғини аниқлаб, ""дожим"" (босим) билан сота оладиган. Камида 30%+ конверсия кўрсатган.",,"3 000 000 – 15 000 000 so'm за месяц, до вычета налогов",
IT Инженер,https://hh.ru/vacancy/131469601?query=it&hhtmFrom=vacancy_search_list,город Аксай,ТОО QHSE-AKBARYS,Высшее профильное образование. Опыт работы мин 3г.,,,
Менеджер по продажам в IT (стажер) / Sales manager IT (trainee),https://hh.ru/vacancy/131357255?query=it&hhtmFrom=vacancy_search_list,Минск,ООО Атлас-Софт Диджитал,Рассматриваем кандидатов без опыта в,,"500 – 800 $ за месяц, до вычета налогов",
IT инженер,https://hh.ru/vacancy/131915083?query=it&hhtmFrom=vacancy_search_list,Ханты-Мансийский автономный округ — Югра,ЭйчарОсы,Среднее или высшее техническое образование. Знание Linux. Опыт в аналогичной сфере не менее 3 лет.,,,
IT инженер,https://hh.ru/vacancy/131915084?query=it&hhtmFrom=vacancy_search_list,Ханты-Мансийский автономный округ — Югра,ЭйчарОсы,Среднее или высшее техническое образование. Знание Linux. Опыт в аналогичной сфере не менее 3 лет.,,,
IT инженер,https://hh.ru/vacancy/131915085?query=it&hhtmFrom=vacancy_search_list,Ханты-Мансийский автономный округ — Югра,ЭйчарОсы,Среднее или высшее техническое образование. Знание Linux. Опыт в аналогичной сфере не менее 3 лет.,,,
IT Рекрутер,https://hh.ru/vacancy/131914811?query=it&hhtmFrom=vacancy_search_list,Москва,ООО Цифроматика,Грамотная устная и письменная речь. Базовое представление о специалистах сферы,,,
Водитель на иномарку компании в IT-холдинг (Категории B),https://hh.ru/vacancy/131629243?query=it&hhtmFrom=vacancy_search_list,Санкт-Петербург,ООО ГРУЗМАСТЕР,"Права категории B. Стаж от 1 года. Нормальное, аккуратное вождение.",,"до 199 000 ₽ за месяц, до вычета налогов",
Менеджер по продаже недвижимости/Риелтор/брокер (IT-компания в сфере недвижимости),https://hh.ru/vacancy/130624624?query=it&hhtmFrom=vacancy_search_list,"Новосибирск, р-н Октябрьский",ТРЕНД НОВОСТРОЙКИ,,,"от 200 000 ₽ за месяц, на руки",
Технический писатель в IT,https://hh.ru/vacancy/131416227?query=it&hhtmFrom=vacancy_search_list,Москва,ООО НПО СТАБАРМ,Понимание специфики и структуры проектной и эксплуатационной документации в сфере,,"140 000 – 200 000 ₽ за месяц, до вычета налогов",
Руководитель склада (IT-оборудование),https://hh.ru/vacancy/131950408?query=it&hhtmFrom=vacancy_search_list,Москва,Ateuco,Умение выстраивать порядок и системную работу склада. Контроль точности складского учета. Способность оптимизировать процессы и повышать скорость работы склада.,,,
Менеджер по продажам в B2B (Fintech / IT / SaaS) / Sales-manager,https://hh.ru/vacancy/131866340?query=it&hhtmFrom=vacancy_search_list,Москва,ООО Центр Еком,2+ лет опыта B2B продаж c циклом сделки от 1 мес. (,,"120 000 – 400 000 ₽ за месяц, на руки",
Аккаунт-менеджер (ИБ/IT),https://hh.ru/vacancy/131340587?query=it&hhtmFrom=vacancy_search_list,Москва,ООО Айтуби,Высшее образование (желательно в сфере информационных технологий или экономики). Опыт работы аккаунт-менеджером или менеджером по продажам в сфере ИБ...,,,
Специалист IT отдела (дежурный),https://hh.ru/vacancy/129208746?query=it&hhtmFrom=vacancy_search_list,"Конаев, Индустриальная улица, 9",ТОО АСТОРИЯ,Знание операционных систем Windows 7-10 на уровне Администрирования. Среднее техническое образование. Опыт работы в сфере,,,
IT-специалист,https://hh.ru/vacancy/131910272?query=it&hhtmFrom=vacancy_search_list,"Новый Уренгой, улица 26-го съезда КПСС, 13А",Ново-Уренгойский ЛО МВД России на транспорте,Базовые знания в области,,"от 85 000 ₽ за месяц, до вычета налогов",
Менеджер по продажам IT,https://hh.ru/vacancy/131880115?query=it&hhtmFrom=vacancy_search_list,"Бишкек, улица Сагымбая манасчы, 106",ОсОО СмартБиз,...хочет развиваться в,,"от 80 000 сом за месяц, на руки",
IT Service Desk Specialist,https://hh.ru/vacancy/131337203?query=it&hhtmFrom=vacancy_search_list,"Алматы, улица Николая Чаплина, 71/66",ТОО MehKaz,ЗНАНИЕ АНГЛИЙСКОГО ЯЗЫКА - ОБЯЗАТЕЛЬНО! Отличный специалист службы поддержки,,,
Юрисконсульт в IT-компанию,https://hh.ru/vacancy/131947977?query=it&hhtmFrom=vacancy_search_list,"Липецк, р-н Советский",ООО Сигнал,"Высшее юридическое образование. Опыт от 1 года до 3 лет — вы уже не студент, но ещё не закостенелый «согласующий».",,,
IT Методолог,https://hh.ru/vacancy/131625937?query=it&hhtmFrom=vacancy_search_list,Москва,Т-Банк. Бизнес и процессы. Compliance,Опыт. Высшее техническое/экономическое/юридическое образование. Опыт работы в банковской сфере или ИТ не менее 2 (двух) лет по одному...,,,
Менеджер по инфраструктуре IT,https://hh.ru/vacancy/129468976?query=it&hhtmFrom=vacancy_search_list,"Москва, р-н Северное Бутово",ООО Саприм,"Опыт работы системным администратором от 4–5 лет. Уверенные и практические знания: Google Workspace. Active Directory, DNS, DHCP, GPO.",,"до 250 000 ₽ за месяц, на руки",
Junior SAP специалист (IT),https://hh.ru/vacancy/131337412?query=it&hhtmFrom=vacancy_search_list,Минск,ООО АтлантКонсалт,Высшее образование (3-4 курс или выпускники технической/,,,
IT менеджер (Администратор 1С),https://hh.ru/vacancy/131964771?query=it&hhtmFrom=vacancy_search_list,Химки,ООО ЕВРО ФУДС,"Высшее образование. Опыт от 3-х лет. Знание прикладных решений 1С. Аналитические способности, ответственность, внимательность.",,,
IT менеджер,https://hh.ru/vacancy/131221290?query=it&hhtmFrom=vacancy_search_list,"Москва, р-н Ростокино",Aston,"ИТ менеджер (Лидерская программа). Формула успеха: Прокачку всех ключевых навыков — от технических (SQL, аналитика) до управленческих. Наши требования к кандидату...",,,
Менеджер по работе с ключевыми клиентами/КАМ в IT-компанию,https://hh.ru/vacancy/131849905?query=it&hhtmFrom=vacancy_search_list,"Казань, р-н Ново-Савиновский",ООО Информационные Бизнес Решения,Имеет опыт продаж в сегменте В2В -,,"до 250 000 ₽ за месяц, на руки",
Менеджер по продажам IT курсов,https://hh.ru/vacancy/131355865?query=it&hhtmFrom=vacancy_search_list,Минск,ООО Аи буст брейн,"Желание учиться и развиваться! Если уже есть опыт продаж — супер (Быстро станешь ТОПом), если нет — мы тебя всему научим.",,"2 160 – 5 200 Br за месяц, до вычета налогов",
Ведущий специалист /IT Специалист,https://hh.ru/vacancy/131947650?query=it&hhtmFrom=vacancy_search_list,"Истра, улица Панфилова, 46",АО МОСТРАНСАВТО,Опыт работы от 1 года. - Высшее или среднее профессиональное образование. - Знание устройства ПК.,,,
Менеджер по продажам IT аустафф,https://hh.ru/vacancy/131963815?query=it&hhtmFrom=vacancy_search_list,"Тула, р-н Центральный",ООО ЕВАППС,Умение находить общий язык с людьми и желание развиваться в продажах. Грамотная устная и письменная речь. Опыт общения с клиентами...,,,
Технический писатель в IT-компанию,https://hh.ru/vacancy/131677511?query=it&hhtmFrom=vacancy_search_list,Москва,ООО Сорб групп,Опыт написания технической документации. Знание технического английского языка. Опыт работы в графических редакторах. Опыт работы в,,,
Водитель экспедитор на автомобиль компании (ФОРД) категория B иномарка в IT Компанию,https://hh.ru/vacancy/131697964?query=it&hhtmFrom=vacancy_search_list,Москва,Найм персонал PRO,Pабoта на нoвых автомобилях(2024г.в) : Fоrd Тrаnsit или Atlаnt Sollеrs. Водительское удостоверение категории B. Опыт вождения по правам...,,"170 000 – 250 000 ₽ за месяц, до вычета налогов",
Системный администратор / IT-специалист,https://hh.ru/vacancy/131335916?query=it&hhtmFrom=vacancy_search_list,Москва,MARELLA,Опыт администрирования Windows и Active Directory. Понимание принципов работы сетевых протоколов. Навыки обслуживания офисной техники и ПК (блочный ремонт).,,,
IT менеджер,https://hh.ru/vacancy/131906307?query=it&hhtmFrom=vacancy_search_list,Минск,Aston,"Студент не младше 3-го курса бакалавриата / специалитета, либо недавний выпускник вуза. Свободный диплом — отсутствие обязательства распределения после окончания вуза.",,"от 850 $ за месяц, до вычета налогов",
Водитель на иномарку компании в IT-холдинг (Категории B),https://hh.ru/vacancy/131629076?query=it&hhtmFrom=vacancy_search_list,"Самара, р-н Красноглинский",ООО ГРУЗМАСТЕР,"Права категории B. Стаж от 1 года. Нормальное, аккуратное вождение.",,"до 139 000 ₽ за месяц, до вычета налогов",
