title,link,address,company,short_description,rich_description,salary,skils
Маркетолог,https://hh.ru/vacancy/131600005?query=%D0%B2%D0%B5%D0%B1+%D0%B4%D0%B8%D0%B7%D0%B0%D0%B9%D0%BD%D0%B5%D1%80&hhtmFrom=vacancy_search_list,"Чита, р-н Центральный",ООО Масма-ДВ,Разбираетесь в современных маркетинговых инструментах и каналах продвижения. Владеете навыками,,"от 55 000 ₽ за месяц, на руки",
Специалист по интернет-маркетингу,https://hh.ru/vacancy/131461895?query=%D0%B2%D0%B5%D0%B1+%D0%B4%D0%B8%D0%B7%D0%B0%D0%B9%D0%BD%D0%B5%D1%80&hhtmFrom=vacancy_search_list,Минск,"Серволюкс, Группа компаний","Директ, Google,Ads, MyTarget, Meta Ads Manager. С навыками",,,
Менеджер спортивного контента,https://hh.ru/vacancy/131248117?query=%D0%B2%D0%B5%D0%B1+%D0%B4%D0%B8%D0%B7%D0%B0%D0%B9%D0%BD%D0%B5%D1%80&hhtmFrom=vacancy_search_list,Санкт-Петербург,ООО Леон,"Отличное знание мира спорта (особенно футбола, тенниса, баскетбола и хоккея). Понимание специфики букмекерского рынка и интересов клиентов букмекерской конторы.",,,
Digital маркетолог,https://hh.ru/vacancy/131647365?query=%D0%B2%D0%B5%D0%B1+%D0%B4%D0%B8%D0%B7%D0%B0%D0%B9%D0%BD%D0%B5%D1%80&hhtmFrom=vacancy_search_list,Санкт-Петербург,Водоканал ГУП СПб,"Высшее образование по специальности экономика и управление, социология, менеджмент, реклама и связи с общественностью. Дополнительное образование в сфере маркетинга.",,"до 179 000 ₽ за месяц, до вычета налогов",
Маркетолог,https://hh.ru/vacancy/131648465?query=%D0%B2%D0%B5%D0%B1+%D0%B4%D0%B8%D0%B7%D0%B0%D0%B9%D0%BD%D0%B5%D1%80&hhtmFrom=vacancy_search_list,"село Архыз, посёлок Романтик, Горная улица, 1",UPRO GROUP Гостиничная управляющая компания,"Проактивны, идейны, ответственны, креативны и пунктуальны. Обладаете опытом работы в маркетинге и SMM от 2-х лет в сфере гостиничного...",,,
Системный аналитик,https://hh.ru/vacancy/131605625?query=%D0%B2%D0%B5%D0%B1+%D0%B4%D0%B8%D0%B7%D0%B0%D0%B9%D0%BD%D0%B5%D1%80&hhtmFrom=vacancy_search_list,Москва,Okko,"Опыт работы с фронтендом и бэкендом, взаимодействия с",,,
Email-маркетолог,https://hh.ru/vacancy/130099524?query=%D0%B2%D0%B5%D0%B1+%D0%B4%D0%B8%D0%B7%D0%B0%D0%B9%D0%BD%D0%B5%D1%80&hhtmFrom=vacancy_search_list,Москва,Ведомости,"Высшее образование ""Интернет-маркетолог"". - Аналогичный опыт работы от 2 лет. - Владение Word, Excel. - Опыт работы с ESP/CRM-системами (например...",,,
Full-stack разработчик,https://hh.ru/vacancy/131673245?query=%D0%B2%D0%B5%D0%B1+%D0%B4%D0%B8%D0%B7%D0%B0%D0%B9%D0%BD%D0%B5%D1%80&hhtmFrom=vacancy_search_list,Волжский (Волгоградская область),WineChef,"Проект: WineSpot — инновационная AI-платформа для виноделен. Обратите внимание: требуется уверенное знание как React/Next.js, так и Vue.js, а также...",,"1 200 – 1 400 ₽ за час, до вычета налогов",
Системный администратор,https://hh.ru/vacancy/131539856?query=%D0%B2%D0%B5%D0%B1+%D0%B4%D0%B8%D0%B7%D0%B0%D0%B9%D0%BD%D0%B5%D1%80&hhtmFrom=vacancy_search_list,Минск,ООО Теорема знаний,HTML/CSS: Базовые знания верстки для коррекции отображения материалов. Понимание,,"от 1 000 Br за месяц, на руки",
Руководитель отдела маркетинга B2B IT в офис (Пермь),https://hh.ru/vacancy/131807716?query=%D0%B2%D0%B5%D0%B1+%D0%B4%D0%B8%D0%B7%D0%B0%D0%B9%D0%BD%D0%B5%D1%80&hhtmFrom=vacancy_search_list,"Пермь, р-н Индустриальный",Macroscop,Опыт работы от 3-х лет на руководящих позициях в маркетинге. Обязателен опыт в B2B (в IT сфере...,,"от 150 000 ₽ за месяц, на руки",
Аккаунт менеджер по спецпроектам,https://hh.ru/vacancy/131652488?query=%D0%B2%D0%B5%D0%B1+%D0%B4%D0%B8%D0%B7%D0%B0%D0%B9%D0%BD%D0%B5%D1%80&hhtmFrom=vacancy_search_list,"Ташкент, Юнусабадский район, улица Абдуллы Кадыри, 39",Kundalik,Опыт работы аккаунт-менеджером или менеджером проектов в медиа / digital / спецпроектах. Опыт работы с Adfox и Яндекс Метрикой.,,,
Wordpress-разработчик,https://hh.ru/vacancy/131503590?query=%D0%B2%D0%B5%D0%B1+%D0%B4%D0%B8%D0%B7%D0%B0%D0%B9%D0%BD%D0%B5%D1%80&hhtmFrom=vacancy_search_list,Москва,ООО Зигмунд Онлайн,"Опыт работы с WordPress обязателен. Опыт верстки и кастомизации тем (PHP, HTML, CSS, JS). Опыт работы с плагинами для WP.",,,
SMM Manager (B2B),https://hh.ru/vacancy/131677263?query=%D0%B2%D0%B5%D0%B1+%D0%B4%D0%B8%D0%B7%D0%B0%D0%B9%D0%BD%D0%B5%D1%80&hhtmFrom=vacancy_search_list,Москва,Robusta,"Опыт работы на позиции SMM от 2 лет. Опыт в B2B (желательно iGaming, affiliate, crypto, fintech или смежных...",,,
Проект-менеджер в сфере вэб-разработки (project owner),https://hh.ru/vacancy/130959929?query=%D0%B2%D0%B5%D0%B1+%D0%B4%D0%B8%D0%B7%D0%B0%D0%B9%D0%BD%D0%B5%D1%80&hhtmFrom=vacancy_search_list,Санкт-Петербург,ООО Славдом,опыт работы над кросс-проектными задачами. - опыт работы с подрядчиками (,,,
Fullstack-разработчик,https://hh.ru/vacancy/131430804?query=%D0%B2%D0%B5%D0%B1+%D0%B4%D0%B8%D0%B7%D0%B0%D0%B9%D0%BD%D0%B5%D1%80&hhtmFrom=vacancy_search_list,Москва,ИП Кочетков Максим Алексанлрович,"Навыки работы с REST API, понимание принципов клиент-серверного взаимодействия. Опыт взаимодействия с",,"70 000 – 100 000 ₽ за месяц, на руки",
Head of E-com & Marketing,https://hh.ru/vacancy/131071539?query=%D0%B2%D0%B5%D0%B1+%D0%B4%D0%B8%D0%B7%D0%B0%D0%B9%D0%BD%D0%B5%D1%80&hhtmFrom=vacancy_search_list,Москва,ООО Детские Инновации,Аналитические и системные навыки. Вы должны уметь разбираться в цифрах и находить точки роста для бизнеса. Опыт успешного руководства e...,,,
Интернет-маркетолог,https://hh.ru/vacancy/131566489?query=%D0%B2%D0%B5%D0%B1+%D0%B4%D0%B8%D0%B7%D0%B0%D0%B9%D0%BD%D0%B5%D1%80&hhtmFrom=vacancy_search_list,"Уфа, р-н Советский",ГК Третий Трест,"Опыт администрирования сайтов, работы с различными CMS (Битрикс и др.). Понимание современного стека",,,
Менеджер по диджитал-маркетингу и программным продуктам,https://hh.ru/vacancy/131231873?query=%D0%B2%D0%B5%D0%B1+%D0%B4%D0%B8%D0%B7%D0%B0%D0%B9%D0%BD%D0%B5%D1%80&hhtmFrom=vacancy_search_list,"Уфа, р-н Советский",ПРАВИЛЬНЫЙ СОТРУДНИК,"...C, CRM,",,,
Web & Graphic Designer,https://hh.ru/vacancy/131394947?query=%D0%B2%D0%B5%D0%B1+%D0%B4%D0%B8%D0%B7%D0%B0%D0%B9%D0%BD%D0%B5%D1%80&hhtmFrom=vacancy_search_list,Санкт-Петербург,Quadcode,Коммерческий опыт работы,,,
Product Designer (web + app),https://hh.ru/vacancy/131291354?query=%D0%B2%D0%B5%D0%B1+%D0%B4%D0%B8%D0%B7%D0%B0%D0%B9%D0%BD%D0%B5%D1%80&hhtmFrom=vacancy_search_list,Москва,"MR Group, группа компаний",Опыт работы продуктовым или,,,
Системный аналитик,https://hh.ru/vacancy/130950862?query=%D0%B2%D0%B5%D0%B1+%D0%B4%D0%B8%D0%B7%D0%B0%D0%B9%D0%BD%D0%B5%D1%80&hhtmFrom=vacancy_search_list,Москва,Газпромбанк,лиц/Физ. лиц. - UI/UX (проектирование клиентских интерфейсов вместе с,,,
"QA Engineer (Middle+/Senior, Product) / QA Инженер",https://hh.ru/vacancy/131739586?query=%D0%B2%D0%B5%D0%B1+%D0%B4%D0%B8%D0%B7%D0%B0%D0%B9%D0%BD%D0%B5%D1%80&hhtmFrom=vacancy_search_list,Санкт-Петербург,ООО Вирэнт,"Коммерческий опыт тестирования от 3 лет. Умение тестировать API (Postman, Swagger), писать SQL-запросы. Умение работать с требованиями и находить...",,"130 000 – 180 000 ₽ за месяц, на руки",
Руководитель проектов,https://hh.ru/vacancy/131533260?query=%D0%B2%D0%B5%D0%B1+%D0%B4%D0%B8%D0%B7%D0%B0%D0%B9%D0%BD%D0%B5%D1%80&hhtmFrom=vacancy_search_list,"Москва, р-н Тверской",ООО Ростелеком Информационные Технологии,Опыт работы с low-code / no-code / BPM-платформами. Понимание базовых принципов,,,
Бизнес-аналитик,https://hh.ru/vacancy/131603739?query=%D0%B2%D0%B5%D0%B1+%D0%B4%D0%B8%D0%B7%D0%B0%D0%B9%D0%BD%D0%B5%D1%80&hhtmFrom=vacancy_search_list,"Москва, р-н Тверской",ООО Ростелеком Информационные Технологии,"Знание требований ГОСТов к формируемым документам. Навык выявления и структурирования требований: интервью, воркшопы, фиксация договоренностей. Умение структурно формировать бизнес-функциональные...",,,
Менеджер отдела маркетинга,https://hh.ru/vacancy/131543308?query=%D0%B2%D0%B5%D0%B1+%D0%B4%D0%B8%D0%B7%D0%B0%D0%B9%D0%BD%D0%B5%D1%80&hhtmFrom=vacancy_search_list,"Москва, р-н Тверской",ФГБУК Российский национальный музей музыки,Опыт работы с email-маркетингом и инструментами автоматизации. Уверенное владение инструментами,,,
UX-проектировщик/Бизнес-аналитик,https://hh.ru/vacancy/131485232?query=%D0%B2%D0%B5%D0%B1+%D0%B4%D0%B8%D0%B7%D0%B0%D0%B9%D0%BD%D0%B5%D1%80&hhtmFrom=vacancy_search_list,Москва,Notamedia,"Знание фреймворков ролей, персон, user stories. Знание основ",,,
Ведущий маркетолог в IT-компанию,https://hh.ru/vacancy/130434419?query=%D0%B2%D0%B5%D0%B1+%D0%B4%D0%B8%D0%B7%D0%B0%D0%B9%D0%BD%D0%B5%D1%80&hhtmFrom=vacancy_search_list,"Ростов-на-Дону, р-н Ленинский",ГЭНДАЛЬФ,"Навыки разработки стратегий, построения цепочек коммуникаций, включая email-рассылки и триггеры. Навыки аналитики и работы с данными (юнит-экономика,",,,
Менеджер по цифровому маркетингу,https://hh.ru/vacancy/130709177?query=%D0%B2%D0%B5%D0%B1+%D0%B4%D0%B8%D0%B7%D0%B0%D0%B9%D0%BD%D0%B5%D1%80&hhtmFrom=vacancy_search_list,Москва,БЮРО 1440,"Опыт работы в телеком, ИТ, технологичных компаниях. Понимание специфики создания, развития и продвижения",,,
Специалист отдела допечатной подготовки,https://hh.ru/vacancy/131113278?query=%D0%B2%D0%B5%D0%B1+%D0%B4%D0%B8%D0%B7%D0%B0%D0%B9%D0%BD%D0%B5%D1%80&hhtmFrom=vacancy_search_list,"посёлок Южный, Северная улица, 2/3",ООО Полибит,Высшее образование. Опыт работы в полиграфии и техническим,,,
Руководитель отдела маркетинга и рекламы,https://hh.ru/vacancy/131705988?query=%D0%B2%D0%B5%D0%B1+%D0%B4%D0%B8%D0%B7%D0%B0%D0%B9%D0%BD%D0%B5%D1%80&hhtmFrom=vacancy_search_list,"Краснодар, р-н Западный",Истринская сыроварня Олега Сироты,Продвинутые навыки,,"от 200 000 ₽ за месяц, на руки",
SEO-специалист / SEO-стратег (аудит + последующая реализация),https://hh.ru/vacancy/131615318?query=%D0%B2%D0%B5%D0%B1+%D0%B4%D0%B8%D0%B7%D0%B0%D0%B9%D0%BD%D0%B5%D1%80&hhtmFrom=vacancy_search_list,Москва,Hastra Agency,"Опыт в SEO от 5 лет. Опыт разработки и внедрения SEO-стратегий. Опыт работы со структурой сайта (кластеризация, распределение запросов).",,,
Маркетолог,https://hh.ru/vacancy/131494868?query=%D0%B2%D0%B5%D0%B1+%D0%B4%D0%B8%D0%B7%D0%B0%D0%B9%D0%BD%D0%B5%D1%80&hhtmFrom=vacancy_search_list,деревня Наугольное,АО Сергиево-Посадский мясокомбинат,"Выпускники ВУЗов по специальности «Маркетолог» (в идеале, но не обязательно!). Интересующиеся web-аналитикой (Яндекс.Метрика, Roistat и проч.). Имеющие опыт работы...",,"65 000 ₽ за месяц, на руки",
Специалист по вайб кодингу,https://hh.ru/vacancy/131425541?query=%D0%B2%D0%B5%D0%B1+%D0%B4%D0%B8%D0%B7%D0%B0%D0%B9%D0%BD%D0%B5%D1%80&hhtmFrom=vacancy_search_list,Москва,Геномед,Практический опыт в создании,,,
Яндекс директолог AI,https://hh.ru/vacancy/131482940?query=%D0%B2%D0%B5%D0%B1+%D0%B4%D0%B8%D0%B7%D0%B0%D0%B9%D0%BD%D0%B5%D1%80&hhtmFrom=vacancy_search_list,Москва,Broad Apps,"Опыт работы с яндекс директ от 1 года. Опыт работы с маркетингом AI. Понимаешь, как оценивать эффективность рекламы (клики, конверсии...",,,
Lead UI/UX Designer (AI Video Platform),https://hh.ru/vacancy/131483819?query=%D0%B2%D0%B5%D0%B1+%D0%B4%D0%B8%D0%B7%D0%B0%D0%B9%D0%BD%D0%B5%D1%80&hhtmFrom=vacancy_search_list,Москва,ООО ЧУБАККА,5+ лет опыта в продуктовом дизайне. – Отличное владение Figma и навыки быстрого прототипирования. – Опыт построения интерфейсов с нуля. –,,,
Маркетолог,https://hh.ru/vacancy/125961024?query=%D0%B2%D0%B5%D0%B1+%D0%B4%D0%B8%D0%B7%D0%B0%D0%B9%D0%BD%D0%B5%D1%80&hhtmFrom=vacancy_search_list,"Павлодар, улица Малайсары Батыра, 88",ТОО Проманалит,"Высшее образование (маркетинг, PR, реклама или смежные направления). Опыт работы в маркетинге от 1 года. Владение ПК и основными графическими...",,,
Маркетолог по продвижению услуг,https://hh.ru/vacancy/130705071?query=%D0%B2%D0%B5%D0%B1+%D0%B4%D0%B8%D0%B7%D0%B0%D0%B9%D0%BD%D0%B5%D1%80&hhtmFrom=vacancy_search_list,Москва,Комус,"Опыт работы с программами лояльности. Навык прогнозирования и аналитики промо активности, расчета эффективности акций. Опыт подготовки брифов для",,,
International Marketing Manager,https://hh.ru/vacancy/130836811?query=%D0%B2%D0%B5%D0%B1+%D0%B4%D0%B8%D0%B7%D0%B0%D0%B9%D0%BD%D0%B5%D1%80&hhtmFrom=vacancy_search_list,Москва,ООО Appbooster,Опыт работы с визуальными формами через коммуникацию с,,,
Системный аналитик,https://hh.ru/vacancy/131603706?query=%D0%B2%D0%B5%D0%B1+%D0%B4%D0%B8%D0%B7%D0%B0%D0%B9%D0%BD%D0%B5%D1%80&hhtmFrom=vacancy_search_list,Новосибирск,Siberian Wellness,Опыт в системном анализе от 2 лет: вы понимаете специфику,,"150 000 – 200 000 ₽ за месяц, до вычета налогов",
Frontend Developer (Middle),https://hh.ru/vacancy/131558606?query=%D0%B2%D0%B5%D0%B1+%D0%B4%D0%B8%D0%B7%D0%B0%D0%B9%D0%BD%D0%B5%D1%80&hhtmFrom=vacancy_search_list,Алматы,АО Банк ЦентрКредит,Опыт во фронтенде от 2-х лет (желательно FinTech/банки). Уверенные знания JavaScript (ES6+) и TypeScript.,,,
SMM-менеджер,https://hh.ru/vacancy/131622111?query=%D0%B2%D0%B5%D0%B1+%D0%B4%D0%B8%D0%B7%D0%B0%D0%B9%D0%BD%D0%B5%D1%80&hhtmFrom=vacancy_search_list,Москва,ООО Лодка,Навыки мобильного монтажа видео. Базовое понимание,,,
Digital Маркетолог,https://hh.ru/vacancy/131437255?query=%D0%B2%D0%B5%D0%B1+%D0%B4%D0%B8%D0%B7%D0%B0%D0%B9%D0%BD%D0%B5%D1%80&hhtmFrom=vacancy_search_list,"Ташкент, проспект Шарафа Рашидова, 71",ООО Tolipov Group Limited,"Уверенное знание таргета (Meta / TikTok). — Понимание воронки продаж и поведения аудитории. — Опыт работы с креативами (что заходит, а что нет). —",,"6 000 000 – 12 000 000 so'm за месяц, на руки",
"Junior Frontend разработчик, Служба разработки и технического сопровождения",https://hh.ru/vacancy/131426906?query=%D0%B2%D0%B5%D0%B1+%D0%B4%D0%B8%D0%B7%D0%B0%D0%B9%D0%BD%D0%B5%D1%80&hhtmFrom=vacancy_search_list,"Астана, проспект Мангилик Ел, 35А",ТОО QazCloud,"Уверенные знания в предметной области. Умение принимать самостоятельные архитектурные решения. Основы сетевого, аппаратного и программного обеспечения. Порядок оформления технической документации.",,,
Пишущий редактор в B2B,https://hh.ru/vacancy/131617055?query=%D0%B2%D0%B5%D0%B1+%D0%B4%D0%B8%D0%B7%D0%B0%D0%B9%D0%BD%D0%B5%D1%80&hhtmFrom=vacancy_search_list,Санкт-Петербург,Геоскан,"Готовы отвечать за материал в целом: текст, иллюстрации, макет (на уровне правок",,,
Junior Manual QA Engineer,https://hh.ru/vacancy/131534525?query=%D0%B2%D0%B5%D0%B1+%D0%B4%D0%B8%D0%B7%D0%B0%D0%B9%D0%BD%D0%B5%D1%80&hhtmFrom=vacancy_search_list,Минск,ООО ФОРТВИЖН,"Умение работать с макетами в Figma и находить несоответствия. Базовое понимание API (например, умение работать с Postman или инструментами разработчика...",,"200 – 500 $ за месяц, на руки",
Руководитель продукта ДБО физических лиц,https://hh.ru/vacancy/129610908?query=%D0%B2%D0%B5%D0%B1+%D0%B4%D0%B8%D0%B7%D0%B0%D0%B9%D0%BD%D0%B5%D1%80&hhtmFrom=vacancy_search_list,Химки,ББР Банк,Умение строить алгоритмы и блок схемы. Понимание технической архитектуры,,,
"Product / UI/UX Designer (Web, Figma)",https://hh.ru/vacancy/131222712?query=%D0%B2%D0%B5%D0%B1+%D0%B4%D0%B8%D0%B7%D0%B0%D0%B9%D0%BD%D0%B5%D1%80&hhtmFrom=vacancy_search_list,Москва,ИП Спиридонов Павел Игоревич,...синхронизироваться с,,,
Интернет-маркетолог,https://hh.ru/vacancy/131678860?query=%D0%B2%D0%B5%D0%B1+%D0%B4%D0%B8%D0%B7%D0%B0%D0%B9%D0%BD%D0%B5%D1%80&hhtmFrom=vacancy_search_list,Москва,ООО ФЕДАСТ ИМПОРТ,"Квалифицированного специалиста в сфере интернет-маркетинга с опытом работы от 2х лет. Специалиста, умеющего работать в команде и отвечать...",,"80 000 – 150 000 ₽ за месяц, на руки",
Full-Stack Analyst,https://hh.ru/vacancy/131536326?query=%D0%B2%D0%B5%D0%B1+%D0%B4%D0%B8%D0%B7%D0%B0%D0%B9%D0%BD%D0%B5%D1%80&hhtmFrom=vacancy_search_list,Лимасол,STARTRIBE LTD. Разработка,"Уверенные знания SQL (в том числе нормализация, JOIN’ы, вложенные запросы). Понимание клиент-серверной архитектуры",,,
QA Automation Engineer (Инженер по автоматизированному тестированию),https://hh.ru/vacancy/131675507?query=%D0%B2%D0%B5%D0%B1+%D0%B4%D0%B8%D0%B7%D0%B0%D0%B9%D0%BD%D0%B5%D1%80&hhtmFrom=vacancy_search_list,"Берёзовский, Уральская улица, 150",ООО АйТиНавигатор,"Обязательно опыт работы от 3 лет автотестирования. Понимание архитектуры баз данных и их взаимодействия с сайтом (Postgress, MySQL, Redis) через...",,"от 150 000 ₽ за месяц, на руки",
Senior UI/UX Designer / Web Designer,https://hh.ru/vacancy/131483556?query=%D0%B2%D0%B5%D0%B1+%D0%B4%D0%B8%D0%B7%D0%B0%D0%B9%D0%BD%D0%B5%D1%80&hhtmFrom=vacancy_search_list,Москва,Rx2Go,"Навыки проведения дизайн-исследований, анализа и работы с обратной связью. Понимание особенностей разработки под web и mobile. Уверенное владение Figma...",,"120 000 – 250 000 ₽ за месяц, на руки",
Ведущий маркетолог,https://hh.ru/vacancy/131577386?query=%D0%B2%D0%B5%D0%B1+%D0%B4%D0%B8%D0%B7%D0%B0%D0%B9%D0%BD%D0%B5%D1%80&hhtmFrom=vacancy_search_list,"рабочий посёлок Краснообск, Восточная улица, 29",Спортивно-оздоровительный комплекс АРМАДА,"Высшее образование (маркетинг, реклама, сервис). 1С, ЕXСЕL продвинутый пользователь (сводные таблицы), БИТРИКС, Яндекс- вебмастер, Яндекс-директ, консоль Google, SEO...",,"от 80 000 ₽ за месяц, до вычета налогов",
Lead Product Designer,https://hh.ru/vacancy/131381873?query=%D0%B2%D0%B5%D0%B1+%D0%B4%D0%B8%D0%B7%D0%B0%D0%B9%D0%BD%D0%B5%D1%80&hhtmFrom=vacancy_search_list,Москва,Peaky Hunters,Опыт работы Senior Product Designer / Lead Product Designer. Божественное владение фигмой. Опыт создания и поддержки дизайн-систем. Понимание сложных интерфейсов...,,"2 500 – 3 500 $ за месяц, до вычета налогов",
Маркетолог корпоративного направления (B2B),https://hh.ru/vacancy/130039447?query=%D0%B2%D0%B5%D0%B1+%D0%B4%D0%B8%D0%B7%D0%B0%D0%B9%D0%BD%D0%B5%D1%80&hhtmFrom=vacancy_search_list,Новосибирск,ООО Гигабайт,Маркетолога с опытом работы в B2B / корпоративном сегменте. Понимание длинных циклов сделки и роли маркетинга в них.,,,
Интернет-маркетолог,https://hh.ru/vacancy/130510638?query=%D0%B2%D0%B5%D0%B1+%D0%B4%D0%B8%D0%B7%D0%B0%D0%B9%D0%BD%D0%B5%D1%80&hhtmFrom=vacancy_search_list,деревня Николо-Хованское,ООО Венеция Стоун,"Высшее образование или профильное образование в области интернет-маркетинга. Владеешь ПК на уровне уверенного пользователя, опыт работы в 1С...",,,
Product Designer,https://hh.ru/vacancy/131451141?query=%D0%B2%D0%B5%D0%B1+%D0%B4%D0%B8%D0%B7%D0%B0%D0%B9%D0%BD%D0%B5%D1%80&hhtmFrom=vacancy_search_list,Москва,ООО HeadHunter::Design,уверенно работает в figma.,,,
Product owner Web,https://hh.ru/vacancy/131247480?query=%D0%B2%D0%B5%D0%B1+%D0%B4%D0%B8%D0%B7%D0%B0%D0%B9%D0%BD%D0%B5%D1%80&hhtmFrom=vacancy_search_list,Москва,ООО Звук,Есть опыт самостоятельного ведения B2C,,,
