title,link,address,company,short_description,rich_description,salary,skils
Графический дизайнер,https://hh.ru/vacancy/129747365?query=%D0%B2%D0%B5%D0%B1+%D0%B4%D0%B8%D0%B7%D0%B0%D0%B9%D0%BD%D0%B5%D1%80&hhtmFrom=vacancy_search_list,Москва,ООО Планета Сириус,"Отличное знание программ Photoshop, Illustrator. Работа с графикой: подготовка, оптимизация, создание. Коммуникация (объяснить свои решения). Критическое мышление и анализ.",,,
Веб-дизайнер,https://hh.ru/vacancy/131521278?query=%D0%B2%D0%B5%D0%B1+%D0%B4%D0%B8%D0%B7%D0%B0%D0%B9%D0%BD%D0%B5%D1%80&hhtmFrom=vacancy_search_list,Санкт-Петербург,"РусКабель, Медиахолдинг",Опыт,,"от 100 000 ₽ за месяц, на руки",
Графический дизайнер,https://hh.ru/vacancy/131820649?query=%D0%B2%D0%B5%D0%B1+%D0%B4%D0%B8%D0%B7%D0%B0%D0%B9%D0%BD%D0%B5%D1%80&hhtmFrom=vacancy_search_list,Новосибирск,Сибирский Оптовый Центр Детских Колясок,"Профильное оконченное образование. Наличие хорошего опыта работы (начинающим специалистам вакансия не подойдет). Уверенное владение Adobe (Photoshop и Illustrator), Figma, Corel...",,"от 70 000 ₽ за месяц, на руки",
Дизайнер,https://hh.ru/vacancy/131709369?query=%D0%B2%D0%B5%D0%B1+%D0%B4%D0%B8%D0%B7%D0%B0%D0%B9%D0%BD%D0%B5%D1%80&hhtmFrom=vacancy_search_list,Москва,Rassvet.digital,Опыт работы,,,
Веб-дизайнер,https://hh.ru/vacancy/131513911?query=%D0%B2%D0%B5%D0%B1+%D0%B4%D0%B8%D0%B7%D0%B0%D0%B9%D0%BD%D0%B5%D1%80&hhtmFrom=vacancy_search_list,Екатеринбург,ООО ВелоСтрана,"Для этого от тебя потребуется: Ты будешь внимателен к деталям, системно подходить к работе и обладать логическим мышлением и придерживаться...",,"от 700 ₽ за час, на руки",
Веб-дизайнер (уровень middle),https://hh.ru/vacancy/130835047?query=%D0%B2%D0%B5%D0%B1+%D0%B4%D0%B8%D0%B7%D0%B0%D0%B9%D0%BD%D0%B5%D1%80&hhtmFrom=vacancy_search_list,Санкт-Петербург,Bono Digital x Creative,"Уверенные знания в Figma, Adobe Photoshop и Adobe Illustrator. Плюсом будут знания Tilda и Midjourney. Опыт от 2х лет...",,,
ИИ Дизайнер,https://hh.ru/vacancy/131816865?query=%D0%B2%D0%B5%D0%B1+%D0%B4%D0%B8%D0%B7%D0%B0%D0%B9%D0%BD%D0%B5%D1%80&hhtmFrom=vacancy_search_list,Москва,ООО Леон,"Работаешь с AI-инструментами: Midjourney, kling , weavy, Nana banana, DALL E, RunwayML, Stable Diffusion, Canva AI и другими.",,,
Графический дизайнер,https://hh.ru/vacancy/131813880?query=%D0%B2%D0%B5%D0%B1+%D0%B4%D0%B8%D0%B7%D0%B0%D0%B9%D0%BD%D0%B5%D1%80&hhtmFrom=vacancy_search_list,Санкт-Петербург,Bolder Agency,Сильное портфолио в графическом и,,,
Старший Веб-дизайнер,https://hh.ru/vacancy/131603499?query=%D0%B2%D0%B5%D0%B1+%D0%B4%D0%B8%D0%B7%D0%B0%D0%B9%D0%BD%D0%B5%D1%80&hhtmFrom=vacancy_search_list,"Москва, р-н Тверской",ООО Ростелеком Информационные Технологии,"Опыт работы с Figma/Pixso. Навык подготовки материалов для разработки: спецификации, ассеты, описание состояний и адаптивности. Умение работать с обратной...",,,
"Коммуникационный дизайнер [Центр развития и продвижения бренда, МТС Веб Сервисы]",https://hh.ru/vacancy/131797256?query=%D0%B2%D0%B5%D0%B1+%D0%B4%D0%B8%D0%B7%D0%B0%D0%B9%D0%BD%D0%B5%D1%80&hhtmFrom=vacancy_search_list,Москва,"""МТС"", Дизайн","Уверенная работа в Figma, Adobe Photoshop / Illustrator. Базовые навыки вёрстки. Умение работать с AI-генерацией изображений (Nano Banana / GPT).",,,
Веб-дизайнер,https://hh.ru/vacancy/131482695?query=%D0%B2%D0%B5%D0%B1+%D0%B4%D0%B8%D0%B7%D0%B0%D0%B9%D0%BD%D0%B5%D1%80&hhtmFrom=vacancy_search_list,Москва,Comelit,"Уверенно работаешь в Tilda Publishing от 2-х лет. Zero Block — твоя основная среда, ты знаешь его возможности и ограничения.",,"80 000 – 110 000 ₽ за месяц, на руки",
Веб-Дизайнер (Тильда),https://hh.ru/vacancy/131589039?query=%D0%B2%D0%B5%D0%B1+%D0%B4%D0%B8%D0%B7%D0%B0%D0%B9%D0%BD%D0%B5%D1%80&hhtmFrom=vacancy_search_list,Москва,Группа проектов ARTDOM,"Опыт на схожей позиции от 3х лет. Владение Tilda, Photoshop, Figma, Illustrator. Внимательность, креативность.",,,
Дизайнер интерфейсов,https://hh.ru/vacancy/131794327?query=%D0%B2%D0%B5%D0%B1+%D0%B4%D0%B8%D0%B7%D0%B0%D0%B9%D0%BD%D0%B5%D1%80&hhtmFrom=vacancy_search_list,Санкт-Петербург,Wanted,Опыт проектирования интерфейсов для мобильных и,,,
Веб-дизайнер,https://hh.ru/vacancy/131437787?query=%D0%B2%D0%B5%D0%B1+%D0%B4%D0%B8%D0%B7%D0%B0%D0%B9%D0%BD%D0%B5%D1%80&hhtmFrom=vacancy_search_list,Москва,ИП Щербаков Василий Владимирович,Стиль: — опыт создания лендингов (НЕ только UI мобильных приложений). — понимание структуры продающих страниц. — чувство современного визуального стиля. Будет плюсом: — опыт...,,"от 80 000 ₽ за услугу, на руки",
Веб-дизайнер,https://hh.ru/vacancy/131437788?query=%D0%B2%D0%B5%D0%B1+%D0%B4%D0%B8%D0%B7%D0%B0%D0%B9%D0%BD%D0%B5%D1%80&hhtmFrom=vacancy_search_list,Сербия,ИП Щербаков Василий Владимирович,Стиль: — опыт создания лендингов (НЕ только UI мобильных приложений). — понимание структуры продающих страниц. — чувство современного визуального стиля. Будет плюсом: — опыт...,,"от 80 000 ₽ за услугу, на руки",
Дизайнер,https://hh.ru/vacancy/131343372?query=%D0%B2%D0%B5%D0%B1+%D0%B4%D0%B8%D0%B7%D0%B0%D0%B9%D0%BD%D0%B5%D1%80&hhtmFrom=vacancy_search_list,"Иваново, р-н Ленинский",BAZAR - ресторан домашней кухни (Ресторан №1),Инновации: Использование ИИ-инструментов в работе (или готовность быстро обучиться). Наши требования: Уверенная работа в растровых и векторных редакторах (Photoshop...,,,
Графический дизайнер,https://hh.ru/vacancy/131796289?query=%D0%B2%D0%B5%D0%B1+%D0%B4%D0%B8%D0%B7%D0%B0%D0%B9%D0%BD%D0%B5%D1%80&hhtmFrom=vacancy_search_list,Санкт-Петербург,"ЗооОптТорг.рф, сеть зоомагазинов","Опыт работы в графическом дизайне от 2 лет. Уверенное владение: Adobe Photoshop, Illustrator, InDesign, Figma. Опыт дизайна и верстки лендингов...",,"от 90 000 ₽ за месяц, на руки",
Дизайнер,https://hh.ru/vacancy/131645389?query=%D0%B2%D0%B5%D0%B1+%D0%B4%D0%B8%D0%B7%D0%B0%D0%B9%D0%BD%D0%B5%D1%80&hhtmFrom=vacancy_search_list,"Москва, р-н Головинский",X-Com,"Вы справитесь с нашим задачами, если у Вас есть опыт работы и знания по следующим направлениям: Умение визуализировать размеры, характеристики...",,,
Графический дизайнер,https://hh.ru/vacancy/131793257?query=%D0%B2%D0%B5%D0%B1+%D0%B4%D0%B8%D0%B7%D0%B0%D0%B9%D0%BD%D0%B5%D1%80&hhtmFrom=vacancy_search_list,Москва,ООО ГРУППА КОМПАНИЙ АК,"Отлично владеет Figma, Adobe Photoshop и Illustrator. Будет здорово, если ты знаком с основами UX/UI и моушн-дизайна, а...",,,
Дизайнер-верстальщик E-mail рассылок в Битрикс24,https://hh.ru/vacancy/131876975?query=%D0%B2%D0%B5%D0%B1+%D0%B4%D0%B8%D0%B7%D0%B0%D0%B9%D0%BD%D0%B5%D1%80&hhtmFrom=vacancy_search_list,Москва,Quadro Expert,"...без flex/grid, особенности Outlook (Word), ширина ~600 px, фолбэки, web-safe шрифты, media queries, изображения (alt), ссылки/трекинг, обязательные...",,"1 000 – 1 500 ₽ за час, на руки",
"Веб-дизайнер/дизайнер интерфейсов (с приоритетом ИИ, без кода)/Web/UI Designer (AI First & No-code)",https://hh.ru/vacancy/131778804?query=%D0%B2%D0%B5%D0%B1+%D0%B4%D0%B8%D0%B7%D0%B0%D0%B9%D0%BD%D0%B5%D1%80&hhtmFrom=vacancy_search_list,Москва,Московский авиационный институт (национальный исследовательский университет),"Требуемый опыт работы: в индустрии Web/UIUX/Graphics от 6 лет обязательно. Полная занятость, полный день. AI — это обязательная часть...",,"150 000 – 180 000 ₽ за месяц, до вычета налогов",
UX/UI-дизайнер,https://hh.ru/vacancy/131831396?query=%D0%B2%D0%B5%D0%B1+%D0%B4%D0%B8%D0%B7%D0%B0%D0%B9%D0%BD%D0%B5%D1%80&hhtmFrom=vacancy_search_list,Москва,ИП Хаминский Антон Яковлевич,"Опыт в UX/UI дизайне от 2 лет. Умение создавать сложные интерфейсы, которые будут адаптироваться под любые устройства.",,,
ИИ веб-дизайнер (без кода/генеративный) / AI Web Designer (No-code/Generative),https://hh.ru/vacancy/131778391?query=%D0%B2%D0%B5%D0%B1+%D0%B4%D0%B8%D0%B7%D0%B0%D0%B9%D0%BD%D0%B5%D1%80&hhtmFrom=vacancy_search_list,Москва,Московский авиационный институт (национальный исследовательский университет),"Требуемый опыт работы: в индустрии Web/UIUX/Graphics от 6 лет обязательно. Полная занятость, полный день. AI — это обязательная часть...",,"150 000 – 180 000 ₽ за месяц, до вычета налогов",
Дизайнер/fashion-аналитик для бренда одежды,https://hh.ru/vacancy/131841701?query=%D0%B2%D0%B5%D0%B1+%D0%B4%D0%B8%D0%B7%D0%B0%D0%B9%D0%BD%D0%B5%D1%80&hhtmFrom=vacancy_search_list,Москва,YOUGO (ООО СТК),"Сумасшедшая любовь к одежде, к fashion. Опыт работы",,,
UX/UI-дизайнер,https://hh.ru/vacancy/131822074?query=%D0%B2%D0%B5%D0%B1+%D0%B4%D0%B8%D0%B7%D0%B0%D0%B9%D0%BD%D0%B5%D1%80&hhtmFrom=vacancy_search_list,Москва,ООО Моринтех,"Продвинутый уровень Figma: Auto Layout, Components & Variants, Variables / Tokens, Design System Libraries. Опыт построения и поддержки дизайн‑систем (от единичных...",,,
Веб-дизайнер,https://hh.ru/vacancy/131422960?query=%D0%B2%D0%B5%D0%B1+%D0%B4%D0%B8%D0%B7%D0%B0%D0%B9%D0%BD%D0%B5%D1%80&hhtmFrom=vacancy_search_list,Москва,ЧПОУ Московский городской открытый колледж,O Опыт работы графическим,,,
"Веб-дизайнер (WordPress, Elementor, Tilda)",https://hh.ru/vacancy/131218257?query=%D0%B2%D0%B5%D0%B1+%D0%B4%D0%B8%D0%B7%D0%B0%D0%B9%D0%BD%D0%B5%D1%80&hhtmFrom=vacancy_search_list,Москва,ОАО Веб Лидер,"Знание PHP, HTML, CSS. Опыт работы с WordPress, Elementor и Tilda. Ответственность и внимательность к деталям.",,"40 000 ₽ за месяц, на руки",
Веб-дизайнер,https://hh.ru/vacancy/131415711?query=%D0%B2%D0%B5%D0%B1+%D0%B4%D0%B8%D0%B7%D0%B0%D0%B9%D0%BD%D0%B5%D1%80&hhtmFrom=vacancy_search_list,Минск,ПК Жилищный баланс,"уверенное владение Figma. - владение базовыми принципами UX/UI. - умение адаптировать дизайн под разные устройства. - вовлеченность, инициативность, адекватное восприятие обратной связи.",,"2 000 – 2 500 Br за месяц, на руки",
Ведущий UX/UI-дизайнер,https://hh.ru/vacancy/122305805?query=%D0%B2%D0%B5%D0%B1+%D0%B4%D0%B8%D0%B7%D0%B0%D0%B9%D0%BD%D0%B5%D1%80&hhtmFrom=vacancy_search_list,Москва,SVK.Digital,"Участие в развитии дизайн-систем. Опыт в роли тимлида, ведущего",,,
Веб-дизайнер,https://hh.ru/vacancy/131405231?query=%D0%B2%D0%B5%D0%B1+%D0%B4%D0%B8%D0%B7%D0%B0%D0%B9%D0%BD%D0%B5%D1%80&hhtmFrom=vacancy_search_list,"Одинцово, Молодёжная улица, 46с1",ООО Деус,Опыт работы,,,
Графический дизайнер,https://hh.ru/vacancy/131749986?query=%D0%B2%D0%B5%D0%B1+%D0%B4%D0%B8%D0%B7%D0%B0%D0%B9%D0%BD%D0%B5%D1%80&hhtmFrom=vacancy_search_list,"Москва, р-н Красносельский",ООО Эстехаб,"Уверенно работать в Figma, Photoshop, Illustrator, Canva. Самостоятельно организовывать работу без постоянного контроля. Предлагать несколько вариантов решений, а не один.",,"от 50 000 ₽ за месяц, на руки",
Веб-программист 1С-Битрикс,https://hh.ru/vacancy/131678189?query=%D0%B2%D0%B5%D0%B1+%D0%B4%D0%B8%D0%B7%D0%B0%D0%B9%D0%BD%D0%B5%D1%80&hhtmFrom=vacancy_search_list,"Киров, р-н Ленинский",ООО Студия Арт Нэт,"Опыт разработки на 1С‑Битрикс (от 2 лет). Уверенное владение PHP, MySQL, ООП. Знание HTML5/CSS3, js...",,"от 80 000 ₽ за месяц, на руки",
Графический дизайнер,https://hh.ru/vacancy/131741926?query=%D0%B2%D0%B5%D0%B1+%D0%B4%D0%B8%D0%B7%D0%B0%D0%B9%D0%BD%D0%B5%D1%80&hhtmFrom=vacancy_search_list,Екатеринбург,kakdela (ИП Постовалова Анастасия Александровна),"Твой уровень middle и выше. Умеешь анализировать и деĸомпозировать задачи, предлагая свои идеи для улучшения. Имеешь навык самостоятельной работы, творческий...",,,
Графический дизайнер Senior/Коммуникационный дизайнер,https://hh.ru/vacancy/131759579?query=%D0%B2%D0%B5%D0%B1+%D0%B4%D0%B8%D0%B7%D0%B0%D0%B9%D0%BD%D0%B5%D1%80&hhtmFrom=vacancy_search_list,"Краснодар, р-н Центральный",2BR брендинговое агентство,"...умение четко и понятно излагать свои мысли как устно, так и письменно. Навыки",,"80 000 – 110 000 ₽ за месяц, на руки",
Креативный дизайнер студии,https://hh.ru/vacancy/131790229?query=%D0%B2%D0%B5%D0%B1+%D0%B4%D0%B8%D0%B7%D0%B0%D0%B9%D0%BD%D0%B5%D1%80&hhtmFrom=vacancy_search_list,Москва,MOX Creative Studio,"Нам нужен человек обладающий развитым художественным видением, способный генерировать инновационные идеи и концепции, постоянно следить за последними трендами в области...",,,
Продуктовый дизайнер,https://hh.ru/vacancy/131707858?query=%D0%B2%D0%B5%D0%B1+%D0%B4%D0%B8%D0%B7%D0%B0%D0%B9%D0%BD%D0%B5%D1%80&hhtmFrom=vacancy_search_list,"Киров, р-н Октябрьский",АО Коммерческий банк «Хлынов»,"Знание Figma (autolayouts, variants, components, styles, slot). Знание гайдлайнов и умение использовать Material Design Guidlines и Human Interface Guidelines.",,,
UI/UX-дизайнер,https://hh.ru/vacancy/131770709?query=%D0%B2%D0%B5%D0%B1+%D0%B4%D0%B8%D0%B7%D0%B0%D0%B9%D0%BD%D0%B5%D1%80&hhtmFrom=vacancy_search_list,Минск,ООО Реальность Будущего,"Коммерческий опыт UX/UI-дизайна от 2 лет (продукты, сервисы, игровые интерфейсы). Уверенная работа в Figma: autolayout, компоненты, вариативность, дизайн...",,"до 2 000 $ за месяц, на руки",
Графический дизайнер,https://hh.ru/vacancy/131709843?query=%D0%B2%D0%B5%D0%B1+%D0%B4%D0%B8%D0%B7%D0%B0%D0%B9%D0%BD%D0%B5%D1%80&hhtmFrom=vacancy_search_list,Санкт-Петербург,AFINA,Опыт работы графическим,,"от 100 000 ₽ за месяц, на руки",
Web-дизайнер на Tilda,https://hh.ru/vacancy/131823542?query=%D0%B2%D0%B5%D0%B1+%D0%B4%D0%B8%D0%B7%D0%B0%D0%B9%D0%BD%D0%B5%D1%80&hhtmFrom=vacancy_search_list,Москва,ИП Алексеева Марина Николаевна,"Опыт работы в маркетинговом агентстве будет большим преимуществом. - Опыт работы с HTML, CSS и JavaScript (для кастомизации на Tilda). -",,"100 000 – 120 000 ₽ за месяц, на руки",
Старший дизайнер,https://hh.ru/vacancy/131704222?query=%D0%B2%D0%B5%D0%B1+%D0%B4%D0%B8%D0%B7%D0%B0%D0%B9%D0%BD%D0%B5%D1%80&hhtmFrom=vacancy_search_list,Москва,Angara Security,"Системное мышление, внимательность к деталям, насмотренность, чувство вкуса и стиля. Умение брифовать младших",,,
Графический дизайнер (iGaming),https://hh.ru/vacancy/131766126?query=%D0%B2%D0%B5%D0%B1+%D0%B4%D0%B8%D0%B7%D0%B0%D0%B9%D0%BD%D0%B5%D1%80&hhtmFrom=vacancy_search_list,Москва,HR ME,Портфолио из релевантных кейсов с прошлых мест работы. Опыт в шаблонизации типовых креативов и оптимизации времени. Опыт работы в,,,
Веб-дизайнер,https://hh.ru/vacancy/131285999?query=%D0%B2%D0%B5%D0%B1+%D0%B4%D0%B8%D0%B7%D0%B0%D0%B9%D0%BD%D0%B5%D1%80&hhtmFrom=vacancy_search_list,"Волгоград, р-н Дзержинский",ООО Живем Дома,Опыт создания сайтов или лендингов. Понимание принципов современного,,"от 80 000 ₽ за месяц, на руки",
Моушн-дизайнер,https://hh.ru/vacancy/131684587?query=%D0%B2%D0%B5%D0%B1+%D0%B4%D0%B8%D0%B7%D0%B0%D0%B9%D0%BD%D0%B5%D1%80&hhtmFrom=vacancy_search_list,"Бишкек, проспект Чуй, 92",ОАО Банк Дос-Кредобанк,"Высшее образование. Опыт работы от 3 до 6 лет в графическом и моушн-дизайне. Навыки разработки визуальных концепций, motion-графики...",,,
Графический дизайнер,https://hh.ru/vacancy/131119526?query=%D0%B2%D0%B5%D0%B1+%D0%B4%D0%B8%D0%B7%D0%B0%D0%B9%D0%BD%D0%B5%D1%80&hhtmFrom=vacancy_search_list,Санкт-Петербург,АО Красный дельфин,"Знание и умение работать в программах MS Office (Word, Excel, Power Point). Опыт работы графическим",,,
Веб-дизайнер,https://hh.ru/vacancy/129037423?query=%D0%B2%D0%B5%D0%B1+%D0%B4%D0%B8%D0%B7%D0%B0%D0%B9%D0%BD%D0%B5%D1%80&hhtmFrom=vacancy_search_list,Москва,Еврокаппа,Портфолио обязательно! Опыт работы в,,,
Архитектор ПО (веб-разработка),https://hh.ru/vacancy/131330256?query=%D0%B2%D0%B5%D0%B1+%D0%B4%D0%B8%D0%B7%D0%B0%D0%B9%D0%BD%D0%B5%D1%80&hhtmFrom=vacancy_search_list,"Ижевск, р-н Первомайский",Welcome Group,"Опыт разработки от 10 лет, с опытом проектированния функционала/узлов/систем. Есть опыт проектирования и эксплуатации нагруженного функционала.",,,
Дизайнер,https://hh.ru/vacancy/131578938?query=%D0%B2%D0%B5%D0%B1+%D0%B4%D0%B8%D0%B7%D0%B0%D0%B9%D0%BD%D0%B5%D1%80&hhtmFrom=vacancy_search_list,Москва,АО Рика,Профильное образование. Опыт работы от 3 до 6 лет. Умение работать с ИИ. Желание развиваться в профессиональном плане.,,"120 000 – 150 000 ₽ за месяц, на руки",
Веб-дизайнер,https://hh.ru/vacancy/131237455?query=%D0%B2%D0%B5%D0%B1+%D0%B4%D0%B8%D0%B7%D0%B0%D0%B9%D0%BD%D0%B5%D1%80&hhtmFrom=vacancy_search_list,Новосибирск,ИП Матасова Ольга Игоревна,Уверенное владение Figma. Уверенное владение Tilda. Понимание основ UX/UI-дизайна. Умение работать в конструкторе или вайбкодинге не по шаблонам...,,"40 000 – 100 000 ₽ за месяц, на руки",
Веб-дизайнер,https://hh.ru/vacancy/131237456?query=%D0%B2%D0%B5%D0%B1+%D0%B4%D0%B8%D0%B7%D0%B0%D0%B9%D0%BD%D0%B5%D1%80&hhtmFrom=vacancy_search_list,Красноярск,ИП Матасова Ольга Игоревна,Уверенное владение Figma. Уверенное владение Tilda. Понимание основ UX/UI-дизайна. Умение работать в конструкторе или вайбкодинге не по шаблонам...,,"40 000 – 100 000 ₽ за месяц, на руки",
Веб‑дизайнер,https://hh.ru/vacancy/131233318?query=%D0%B2%D0%B5%D0%B1+%D0%B4%D0%B8%D0%B7%D0%B0%D0%B9%D0%BD%D0%B5%D1%80&hhtmFrom=vacancy_search_list,"Тольятти, р-н Автозаводский",ООО Айкью Групп,"Уверенный пользователь Figma, Adobe Illustrator, Photoshop — это ваш основной рабочий набор. Портфолио с примерами",,"от 70 000 ₽ за месяц, на руки",
Графический дизайнер (Middle+),https://hh.ru/vacancy/131758980?query=%D0%B2%D0%B5%D0%B1+%D0%B4%D0%B8%D0%B7%D0%B0%D0%B9%D0%BD%D0%B5%D1%80&hhtmFrom=vacancy_search_list,Москва,Market Group,Опыт подготовки макетов к печати и в,,,
Графический дизайнер,https://hh.ru/vacancy/131669260?query=%D0%B2%D0%B5%D0%B1+%D0%B4%D0%B8%D0%B7%D0%B0%D0%B9%D0%BD%D0%B5%D1%80&hhtmFrom=vacancy_search_list,"Москва, р-н Строгино",ЦЕНТРСВЕТ,"Внимательность к деталям, насмотренность, чувство вкуса и стиля. Опыт работы в графических программах и с полиграфией. Наличие портфолио - обязательно!",,"от 150 000 ₽ за месяц, на руки",
Веб-дизайнер,https://hh.ru/vacancy/130430989?query=%D0%B2%D0%B5%D0%B1+%D0%B4%D0%B8%D0%B7%D0%B0%D0%B9%D0%BD%D0%B5%D1%80&hhtmFrom=vacancy_search_list,Москва,Международная медиагруппа Россия сегодня (МИА Россия сегодня),"Уверенное владение Figma. Опыт работы с дизайн-системами. Дотошность, внимание к деталям (в том числе в организации макетов).",,,
Младший коммуникационный дизайнер,https://hh.ru/vacancy/131741127?query=%D0%B2%D0%B5%D0%B1+%D0%B4%D0%B8%D0%B7%D0%B0%D0%B9%D0%BD%D0%B5%D1%80&hhtmFrom=vacancy_search_list,Москва,Метр квадратный,"Активность и инициативность. Аккуратность и внимание к деталям. Хорошие базовые знания типографики, вёрстки и композиции. Уверенное владение Figma или Pixso...",,,
Графический дизайнер,https://hh.ru/vacancy/131667902?query=%D0%B2%D0%B5%D0%B1+%D0%B4%D0%B8%D0%B7%D0%B0%D0%B9%D0%BD%D0%B5%D1%80&hhtmFrom=vacancy_search_list,Санкт-Петербург,Холдинг AAG,"Ссылку на портфолио. Отличное знание Photoshop, Illustrator, InDesign, After Effects (или умение работать с видео в других программах, желательно из...",,,
